Title,Authors,Corporate Authors,Editors,Book Editors,Source Title,Publication Date,Publication Year,Volume,Issue,Part Number,Supplement,Special Issue,Beginning Page,Ending Page,Article Number,DOI,Conference Title,Conference Date,Total Citations,Average per Year,1975,1976,1977,1978,1979,1980,1981,1982,1983,1984,1985,1986,1987,1988,1989,1990,1991,1992,1993,1994,1995,1996,1997,1998,1999,2000,2001,2002,2003,2004,2005,2006,2007,2008,2009,2010,2011,2012,2013,2014,2015,2016,2017,2018,2019,2020,2021,2022,2023
DETERMINATION OF THE PHENYLMERCURY OUT OF PHENOSEPT BY POLAROGRAPHY IN A SINUSOIDAL ALTERNATIVE CURRENT,"TANASE, I; IONECI, I; LUCA, C",,,,REVISTA DE CHIMIE,APR 1986,1986,37,4,,,,336,337,,,,,0,0,0,0,0,0,0,0,0,0,0,0,0,0,0,0,0,0,0,0,0,0,0,0,0,0,0,0,0,0,0,0,0,0,0,0,0,0,0,0,0,0,0,0,0,0,0,0,0,0,0
"HYDROGENOLYSIS REACTION OF 4-PHENYL-1,3-DIOXANE ON VARIOUS CATALYSTS","BORA, G; BEU, L; FEY, L; BODIS, E; FARCASANU, I; RUSSU, J; TODOR, S",,,,REVISTA DE CHIMIE,MAR 1986,1986,37,3,,,,209,210,,,,,0,0,0,0,0,0,0,0,0,0,0,0,0,0,0,0,0,0,0,0,0,0,0,0,0,0,0,0,0,0,0,0,0,0,0,0,0,0,0,0,0,0,0,0,0,0,0,0,0,0,0
SYNTHESIS AND CHARACTERIZATION OF SOME CYANACRYLIC ESTERS .1. SYNTHESIS OF METHYL AND ETHYL CYANACETATES,"CALUGARU, EM; POPA, AA; DUMITRESCU, G; NEGULESCU, I",,,,REVISTA DE CHIMIE,MAR 1986,1986,37,3,,,,193,196,,,,,0,0,0,0,0,0,0,0,0,0,0,0,0,0,0,0,0,0,0,0,0,0,0,0,0,0,0,0,0,0,0,0,0,0,0,0,0,0,0,0,0,0,0,0,0,0,0,0,0,0,0
NEW TECHNOLOGIES AND MATERIALS IN THE INORGANIC INDUSTRY AND IN THE NONFERROUS METALLURGY,"FLORESCU, M",,,,REVISTA DE CHIMIE,MAR 1986,1986,37,3,,,,189,191,,,,,0,0,0,0,0,0,0,0,0,0,0,0,0,0,0,0,0,0,0,0,0,0,0,0,0,0,0,0,0,0,0,0,0,0,0,0,0,0,0,0,0,0,0,0,0,0,0,0,0,0,0
HYDRODYNAMIC ASPECTS IN THE FLOWING FLUIDIZED-BED,"JINESCU, G; BALABAN, C; IACOBINI, A",,,,REVISTA DE CHIMIE,MAR 1986,1986,37,3,,,,229,235,,,,,0,0,0,0,0,0,0,0,0,0,0,0,0,0,0,0,0,0,0,0,0,0,0,0,0,0,0,0,0,0,0,0,0,0,0,0,0,0,0,0,0,0,0,0,0,0,0,0,0,0,0
"SYNTHESIS OF 3,3=,4,4=-BENZOPHENONTETRACARBOXYLIC ACID","MUJA, I",,,,REVISTA DE CHIMIE,MAR 1986,1986,37,3,,,,202,208,,,,,0,0,0,0,0,0,0,0,0,0,0,0,0,0,0,0,0,0,0,0,0,0,0,0,0,0,0,0,0,0,0,0,0,0,0,0,0,0,0,0,0,0,0,0,0,0,0,0,0,0,0
ANALYSIS OF ALUMINUM FROM MOLECULAR-SIEVES,"SARGHIE, I; SIMION, C; BILBA, D",,,,REVISTA DE CHIMIE,MAR 1986,1986,37,3,,,,244,245,,,,,0,0,0,0,0,0,0,0,0,0,0,0,0,0,0,0,0,0,0,0,0,0,0,0,0,0,0,0,0,0,0,0,0,0,0,0,0,0,0,0,0,0,0,0,0,0,0,0,0,0,0
MATHEMATICAL-MODEL FOR EQUIPMENTS SELECTION UNDER IMPRECISION CONDITIONS,"SAVA, IM",,,,REVISTA DE CHIMIE,MAR 1986,1986,37,3,,,,236,238,,,,,0,0,0,0,0,0,0,0,0,0,0,0,0,0,0,0,0,0,0,0,0,0,0,0,0,0,0,0,0,0,0,0,0,0,0,0,0,0,0,0,0,0,0,0,0,0,0,0,0,0,0
CATALYTIC CONDENSATION IN VAPORS PHASE OF ANILYNE TO DIPHENYLAMINE .1. STUDY OF THE ALUMINE DEACTIVATION PROCESS,"TEUSDEA, M; TANASESCU, R; DELEANU, T; ANTONOVICI, I; BOTA, T",,,,REVISTA DE CHIMIE,MAR 1986,1986,37,3,,,,197,201,,,,,0,0,0,0,0,0,0,0,0,0,0,0,0,0,0,0,0,0,0,0,0,0,0,0,0,0,0,0,0,0,0,0,0,0,0,0,0,0,0,0,0,0,0,0,0,0,0,0,0,0,0
DEPOSITION OF PREPARATIONS ON POLYAMIDIC FIBERS BY USING RADIOACTIVE-TRACERS .1. INFLUENCE OF PREPARATION NATURE AND CONCENTRATION,"VASILESCU, P; VOIN, I; MAXIM, C; PATRICIU, M",,,,REVISTA DE CHIMIE,MAR 1986,1986,37,3,,,,215,217,,,,,0,0,0,0,0,0,0,0,0,0,0,0,0,0,0,0,0,0,0,0,0,0,0,0,0,0,0,0,0,0,0,0,0,0,0,0,0,0,0,0,0,0,0,0,0,0,0,0,0,0,0
CORROSION IN THE SYSTEM CU-FE-LITHIUM BROMIDE SOLUTION .1.,"APOSTOLESCU, M; IVASCAN, S; PANTIRU, E; RADU, L; MUNTEANU, D",,,,REVISTA DE CHIMIE,FEB 1986,1986,37,2,,,,155,156,,,,,0,0,0,0,0,0,0,0,0,0,0,0,0,0,0,0,0,0,0,0,0,0,0,0,0,0,0,0,0,0,0,0,0,0,0,0,0,0,0,0,0,0,0,0,0,0,0,0,0,0,0
GAS-CHROMATOGRAPHIC DETERMINATION OF TETRALINE AND DECALINE FROM THE HYDROFINATED NAPHTALINE BY MEANS OF A GLASS-CAPILLARY COLUMN,"BUDRUGEAC, S",,,,REVISTA DE CHIMIE,FEB 1986,1986,37,2,,,,151,152,,,,,0,0,0,0,0,0,0,0,0,0,0,0,0,0,0,0,0,0,0,0,0,0,0,0,0,0,0,0,0,0,0,0,0,0,0,0,0,0,0,0,0,0,0,0,0,0,0,0,0,0,0
DIMETHYLFORMAMIDE BASED REACTIVES USED IN THE ORGANIC-CHEMISTRY,"CHIRIAC, CI; RACARU, G; CHIRIAC, F; CRAESCU, D; TRUSCAN, I",,,,REVISTA DE CHIMIE,FEB 1986,1986,37,2,,,,113,116,,,,,0,0,0,0,0,0,0,0,0,0,0,0,0,0,0,0,0,0,0,0,0,0,0,0,0,0,0,0,0,0,0,0,0,0,0,0,0,0,0,0,0,0,0,0,0,0,0,0,0,0,0
ELACTOANALYTICAL STUDY OF PHENYLMERCURY CATION IN AQUEOUS-MEDIUM,"IONECI, I; TANASE, I; LUCA, C",,,,REVISTA DE CHIMIE,FEB 1986,1986,37,2,,,,143,147,,,,,0,0,0,0,0,0,0,0,0,0,0,0,0,0,0,0,0,0,0,0,0,0,0,0,0,0,0,0,0,0,0,0,0,0,0,0,0,0,0,0,0,0,0,0,0,0,0,0,0,0,0
ELECTROCATALYSTS CORROSION IN COMBUSTION CELLS WITH HYDRAZINE,"ONICIU, L; TOPAN, VA; MURESAN, L; GHERTOIU, D",,,,REVISTA DE CHIMIE,FEB 1986,1986,37,2,,,,153,154,,,,,0,0,0,0,0,0,0,0,0,0,0,0,0,0,0,0,0,0,0,0,0,0,0,0,0,0,0,0,0,0,0,0,0,0,0,0,0,0,0,0,0,0,0,0,0,0,0,0,0,0,0
"NITRILS HYDROLYSIS, ALKALINE-HYDROLYSIS OF SOME ALPHA, BETA-UNSATURATED NITRILS DERIVED FROM BENZILIDENE-PARA-METOXYPHENYL-ACETONITRILE","ZAVOIANU, D; MOGAGHEORGHE, S; CUZA, O; ZAVOIANU, R",,,,REVISTA DE CHIMIE,FEB 1986,1986,37,2,,,,120,124,,,,,0,0,0,0,0,0,0,0,0,0,0,0,0,0,0,0,0,0,0,0,0,0,0,0,0,0,0,0,0,0,0,0,0,0,0,0,0,0,0,0,0,0,0,0,0,0,0,0,0,0,0
USE OF PLASMA AT TITANIUM NITRATE SYNTHESIS,"BECHERESCU, D; LAZAU, I",,,,REVISTA DE CHIMIE,JAN 1986,1986,37,1,,,,27,29,,,,,0,0,0,0,0,0,0,0,0,0,0,0,0,0,0,0,0,0,0,0,0,0,0,0,0,0,0,0,0,0,0,0,0,0,0,0,0,0,0,0,0,0,0,0,0,0,0,0,0,0,0
THE ADSORPTION MECHANISM OF METALLIC CATIONS ON IONS EXCHANGING RESINS,"DINU, M",,,,REVISTA DE CHIMIE,JAN 1986,1986,37,1,,,,42,47,,,,,0,0,0,0,0,0,0,0,0,0,0,0,0,0,0,0,0,0,0,0,0,0,0,0,0,0,0,0,0,0,0,0,0,0,0,0,0,0,0,0,0,0,0,0,0,0,0,0,0,0,0
OPTIMIZATION OF A SYSTEM FOR HEAT-RECOVERY FROM A PLANT FOR ATMOSPHERIC AND VACUUM OIL DISTILLATION,"DOBRINESCU, D; PATRASCU, C",,,,REVISTA DE CHIMIE,JAN 1986,1986,37,1,,,,55,60,,,,,0,0,0,0,0,0,0,0,0,0,0,0,0,0,0,0,0,0,0,0,0,0,0,0,0,0,0,0,0,0,0,0,0,0,0,0,0,0,0,0,0,0,0,0,0,0,0,0,0,0,0
MASS-TRANSFER IN NONSTATIONARY REGIME FROM A SPHERICAL DROPLET TO A LIQUID WITH VISCOUS-FLOW,"FLOAREA, O; MIHAI, M",,,,REVISTA DE CHIMIE,JAN 1986,1986,37,1,,,,51,54,,,,,0,0,0,0,0,0,0,0,0,0,0,0,0,0,0,0,0,0,0,0,0,0,0,0,0,0,0,0,0,0,0,0,0,0,0,0,0,0,0,0,0,0,0,0,0,0,0,0,0,0,0
BEHAVIOR OF CHROME CONTAINING STEEL FROM THE POINT-OF-VIEW OF RESISTANCE TO CORROSION,"SCHMIDT, L",,,,REVISTA DE CHIMIE,JAN 1986,1986,37,1,,,,68,73,,,,,0,0,0,0,0,0,0,0,0,0,0,0,0,0,0,0,0,0,0,0,0,0,0,0,0,0,0,0,0,0,0,0,0,0,0,0,0,0,0,0,0,0,0,0,0,0,0,0,0,0,0
DECOMPOSITION OF CALCIUM-CARBONATE WITH AMMONIUM-CHLORIDE .2. INFLUENCE OF KINETIC-PARAMETERS ON THE PROCESS RATE,"SZEP, A; CALISTRU, C; IFRIM, L; MIHAILA, G; DRELCIUC, G",,,,REVISTA DE CHIMIE,JAN 1986,1986,37,1,,,,31,36,,,,,0,0,0,0,0,0,0,0,0,0,0,0,0,0,0,0,0,0,0,0,0,0,0,0,0,0,0,0,0,0,0,0,0,0,0,0,0,0,0,0,0,0,0,0,0,0,0,0,0,0,0
SYNTHESIS OF INTERMEDIATES AND DYESTUFFS BASED ON PARA-PHENOTIDINE,"URSEANU, E; DRAGHICI, C; DANILA, F",,,,REVISTA DE CHIMIE,JAN 1986,1986,37,1,,,,7,11,,,,,0,0,0,0,0,0,0,0,0,0,0,0,0,0,0,0,0,0,0,0,0,0,0,0,0,0,0,0,0,0,0,0,0,0,0,0,0,0,0,0,0,0,0,0,0,0,0,0,0,0,0
INFLUENCE OF ALKALINE CHLORIDES ON THE ADSORPTION OF COBALT AND COPPER ON IONS EXCHANGING RESINS,"DINU, M",,,,REVISTA DE CHIMIE,DEC 1985,1985,36,12,,,,1113,1115,,,,,0,0,0,0,0,0,0,0,0,0,0,0,0,0,0,0,0,0,0,0,0,0,0,0,0,0,0,0,0,0,0,0,0,0,0,0,0,0,0,0,0,0,0,0,0,0,0,0,0,0,0
2 DIMENSIONS MATHEMATICAL-MODEL OF MASS-TRANSFER IN STATIONARY REGIME FROM A SPHERICAL DROPLET TO A LIQUID WITH VISCOUS-FLOW .2.,"FLOAREA, O; FLUIERASU, C; MIHAI, M",,,,REVISTA DE CHIMIE,DEC 1985,1985,36,12,,,,1134,1137,,,,,0,0,0,0,0,0,0,0,0,0,0,0,0,0,0,0,0,0,0,0,0,0,0,0,0,0,0,0,0,0,0,0,0,0,0,0,0,0,0,0,0,0,0,0,0,0,0,0,0,0,0
EFFECT OF FREE STANDARD ENTHALPIES ERRORS OF FORMING ON THE CHEMICAL-EQUILIBRIUM COMPOSITION,"LANDAUER, O; GEANA, D; IULIAN, O",,,,REVISTA DE CHIMIE,DEC 1985,1985,36,12,,,,1154,1154,,,,,0,0,0,0,0,0,0,0,0,0,0,0,0,0,0,0,0,0,0,0,0,0,0,0,0,0,0,0,0,0,0,0,0,0,0,0,0,0,0,0,0,0,0,0,0,0,0,0,0,0,0
PROPERTIES OF REAL SOLUTIONS OF FLUOROSILICIC ACID,"LEONTE, C; TALABA, A; AELENEI, N; SMOCOT, R",,,,REVISTA DE CHIMIE,DEC 1985,1985,36,12,,,,1125,1129,,,,,0,0,0,0,0,0,0,0,0,0,0,0,0,0,0,0,0,0,0,0,0,0,0,0,0,0,0,0,0,0,0,0,0,0,0,0,0,0,0,0,0,0,0,0,0,0,0,0,0,0,0
"1,4-DI(TRICHLOROMETHYL)BENZENE - PROPERTIES AND APPLICATIONS","MUJA, I; MARCULESCU, N; OBOGEANU, F; ENACHE, M",,,,REVISTA DE CHIMIE,DEC 1985,1985,36,12,,,,1095,1098,,,,,0,0,0,0,0,0,0,0,0,0,0,0,0,0,0,0,0,0,0,0,0,0,0,0,0,0,0,0,0,0,0,0,0,0,0,0,0,0,0,0,0,0,0,0,0,0,0,0,0,0,0
ANALYSIS OF PHOSPHORUS AND POTASSIUM FROM COMPLEX FERTILIZERS BY X-RAYS FLUORESCENT EMISSION-SPECTROMETRY,"NEAGOE, NC; COSTACHESCU, D; SCROBOHACI, A; RAICU, M",,,,REVISTA DE CHIMIE,DEC 1985,1985,36,12,,,,1150,1153,,,,,0,0,0,0,0,0,0,0,0,0,0,0,0,0,0,0,0,0,0,0,0,0,0,0,0,0,0,0,0,0,0,0,0,0,0,0,0,0,0,0,0,0,0,0,0,0,0,0,0,0,0
PREPARATION OF SYNTHETIC MORDENITE,"ONU, P; GANJU, D",,,,REVISTA DE CHIMIE,DEC 1985,1985,36,12,,,,1121,1124,,,,,0,0,0,0,0,0,0,0,0,0,0,0,0,0,0,0,0,0,0,0,0,0,0,0,0,0,0,0,0,0,0,0,0,0,0,0,0,0,0,0,0,0,0,0,0,0,0,0,0,0,0
SIGMATATION OF STEELS AND WELDINGS UNDER THE CONDITIONS OF THE TUBULAR COMPONENTS OF THE PETROCHEMICAL OVENS,"PAVEL, A",,,,REVISTA DE CHIMIE,DEC 1985,1985,36,12,,,,1155,1155,,,,,0,0,0,0,0,0,0,0,0,0,0,0,0,0,0,0,0,0,0,0,0,0,0,0,0,0,0,0,0,0,0,0,0,0,0,0,0,0,0,0,0,0,0,0,0,0,0,0,0,0,0
ABIOTIC REDUCTIVE FIXATION OF MOLECULAR NITROGEN .4.,"STRAJESCU, M; JELERIU, S; VICOL, M; MARGINEANU, F; VOLOSNIC, M",,,,REVISTA DE CHIMIE,DEC 1985,1985,36,12,,,,1156,1162,,,,,0,0,0,0,0,0,0,0,0,0,0,0,0,0,0,0,0,0,0,0,0,0,0,0,0,0,0,0,0,0,0,0,0,0,0,0,0,0,0,0,0,0,0,0,0,0,0,0,0,0,0
"STRUCTURE AND REACTIVITY OF NITRILS - COMBUSTION AND FORMATION HEAT OF SOME ALPHA, BETA-UNSATURATED NITRILS DERIVED FROM P-CHLOROPHENYLACETONITRILE BENZILIDENE","ZAVOIANU, D; CIOCAZANU, I; MOGAGHEORGHE, S; CUZA, O; ZAVOIANU, R",,,,REVISTA DE CHIMIE,DEC 1985,1985,36,12,,,,1099,1101,,,,,0,0,0,0,0,0,0,0,0,0,0,0,0,0,0,0,0,0,0,0,0,0,0,0,0,0,0,0,0,0,0,0,0,0,0,0,0,0,0,0,0,0,0,0,0,0,0,0,0,0,0
"SYNTHESIS, STRUCTURE AND REACTIONS OF 2-(1-METHYL-PROPILIDENE)-CYCLOHEXYLAMINE","BARBULESCU, N; CUZA, O; BARBULESCU, E; MOGAGHEORGHE, S; ZAVOIANU, D; HUPPERT, A",,,,REVISTA DE CHIMIE,NOV 1985,1985,36,11,,,,985,989,,,,,0,0,0,0,0,0,0,0,0,0,0,0,0,0,0,0,0,0,0,0,0,0,0,0,0,0,0,0,0,0,0,0,0,0,0,0,0,0,0,0,0,0,0,0,0,0,0,0,0,0,0
STUDY OF THE CHEMICOPHYSICAL PROPERTIES OF ALUMINES PROMOTED WITH METALLIC DIOXIDES .11. NATURE AND MOBILITY OF SUPERFICIAL PROTONS,"DULAMITA, N",,,,REVISTA DE CHIMIE,NOV 1985,1985,36,11,,,,1050,1051,,,,,0,0,0,0,0,0,0,0,0,0,0,0,0,0,0,0,0,0,0,0,0,0,0,0,0,0,0,0,0,0,0,0,0,0,0,0,0,0,0,0,0,0,0,0,0,0,0,0,0,0,0
SEPARATION OF TH AND U BY A CONTINUOUS PROCESS WITH SOLVENTS EXTRACTION,"PERESCU, N; IONESCU, A; BUJOREANU, D; BALAN, V",,,,REVISTA DE CHIMIE,NOV 1985,1985,36,11,,,,1039,1042,,,,,0,0,0,0,0,0,0,0,0,0,0,0,0,0,0,0,0,0,0,0,0,0,0,0,0,0,0,0,0,0,0,0,0,0,0,0,0,0,0,0,0,0,0,0,0,0,0,0,0,0,0
A POSSIBILITY OF PREDICTING SOME INORGANIC POLYMERS STRUCTURES REGARDING THE VITREOUS STATE .2. STEREOCHEMICAL TYPES OF INORGANIC POLYMERS,"RADU, D",,,,REVISTA DE CHIMIE,NOV 1985,1985,36,11,,,,999,1003,,,,,0,0,0,0,0,0,0,0,0,0,0,0,0,0,0,0,0,0,0,0,0,0,0,0,0,0,0,0,0,0,0,0,0,0,0,0,0,0,0,0,0,0,0,0,0,0,0,0,0,0,0
STUDY OF THE PROCESS OF CALCIUM-CARBONATE DECOMPOSITION WITH AMMONIUM-CHLORIDE .1. SUBLIMATION OF AMMONIUM-CHLORIDE,"SZEP, A; CALISTRU, C; IFRIM, L; MIHAILA, G",,,,REVISTA DE CHIMIE,NOV 1985,1985,36,11,,,,1014,1020,,,,,0,0,0,0,0,0,0,0,0,0,0,0,0,0,0,0,0,0,0,0,0,0,0,0,0,0,0,0,0,0,0,0,0,0,0,0,0,0,0,0,0,0,0,0,0,0,0,0,0,0,0
MODELING OF HEAT BALANCES UNDER CONDITIONS OF RISK AND UNCERTAINTY - AN APPLICATION,"BADEA, L; CUTCUTACHE, A",,,,REVISTA DE CHIMIE,1985,1985,36,3,,,,237,239,,,,,0,0,0,0,0,0,0,0,0,0,0,0,0,0,0,0,0,0,0,0,0,0,0,0,0,0,0,0,0,0,0,0,0,0,0,0,0,0,0,0,0,0,0,0,0,0,0,0,0,0,0
BEHAVIOR OF MOLECULAR-SIEVES AT DRYING AIR WITH DIFFERENT MOISTURE-CONTENT,"BALDEA, A; AXENTE, D; ABRUNDEAN, M; LUNGU, S",,,,REVISTA DE CHIMIE,1985,1985,36,5,,,,419,423,,,,,0,0,0,0,0,0,0,0,0,0,0,0,0,0,0,0,0,0,0,0,0,0,0,0,0,0,0,0,0,0,0,0,0,0,0,0,0,0,0,0,0,0,0,0,0,0,0,0,0,0,0
EQUATION OF POLAROGRAPHIC WAVE FOR ELECTRODE PROCESSES IN WHICH THE REACTANT ADSORPTION DEPENDS ON POTENTIAL - THE APPROXIMATIVE FORM FOR THE CASE OF POLARIZATION OF NEGLIGIBLE CONCENTRATION,"BANICA, FG",,,,REVISTA DE CHIMIE,1985,1985,36,10,,,,959,959,,,,,0,0,0,0,0,0,0,0,0,0,0,0,0,0,0,0,0,0,0,0,0,0,0,0,0,0,0,0,0,0,0,0,0,0,0,0,0,0,0,0,0,0,0,0,0,0,0,0,0,0,0
STUDIES IN THE SERIES OF TRICYCLO(7.3.1.02.7)TRIDECANES .7. DERIVATIVES OF AMINOALCOHOLS OBTAINED FROM THE OXIME OF 8-METHYL-TRICYCLO(7.3.1.02.7)TRIDECANE-2-OL-13-ONE,"BARBULESCU, N; NICOLAE, A; COCU, F",,,,REVISTA DE CHIMIE,1985,1985,36,3,,,,197,201,,,,,0,0,0,0,0,0,0,0,0,0,0,0,0,0,0,0,0,0,0,0,0,0,0,0,0,0,0,0,0,0,0,0,0,0,0,0,0,0,0,0,0,0,0,0,0,0,0,0,0,0,0
BEHAVIOR AT SEA-WATER CORROSION OF SOME NONFERROUS ALLOYS,"BEIZADEA, G; ROMAN, E; POPA, MV; DASCALESCU, V",,,,REVISTA DE CHIMIE,1985,1985,36,5,,,,430,434,,,,,0,0,0,0,0,0,0,0,0,0,0,0,0,0,0,0,0,0,0,0,0,0,0,0,0,0,0,0,0,0,0,0,0,0,0,0,0,0,0,0,0,0,0,0,0,0,0,0,0,0,0
KINETIC AND THERMOCHEMICAL ASPECTS OF THE REACTION BETWEEN FORMIC ALDEHYDE AND N-BUTYRIC ALDEHYDE,"BELDIE, C; AELENEI, N; ONU, A; NEMTOI, G; SARGHIE, I; POPA, M; SIMION, C",,,,REVISTA DE CHIMIE,1985,1985,36,3,,,,223,225,,,,,0,0,0,0,0,0,0,0,0,0,0,0,0,0,0,0,0,0,0,0,0,0,0,0,0,0,0,0,0,0,0,0,0,0,0,0,0,0,0,0,0,0,0,0,0,0,0,0,0,0,0
SYNTHESIS OF SOME PSYCHOTROPE PRODUCTS WITH TRICYCLIC STRUCTURE,"BREAZU, D; SCLIFOS, M; POP, E; MILOIA, R",,,,REVISTA DE CHIMIE,1985,1985,36,7,,,,617,620,,,,,0,0,0,0,0,0,0,0,0,0,0,0,0,0,0,0,0,0,0,0,0,0,0,0,0,0,0,0,0,0,0,0,0,0,0,0,0,0,0,0,0,0,0,0,0,0,0,0,0,0,0
ELECTRICAL CONDUCTIBILITY OF ORGANIC-COMPOUNDS .2. THE MECHANISM OF FORMATION OF SOLITONIC TYPE EXCITATIONS BY THE CONVERSION OF BIPOLARONS,"CALUSARU, A",,,,REVISTA DE CHIMIE,1985,1985,36,5,,,,411,418,,,,,0,0,0,0,0,0,0,0,0,0,0,0,0,0,0,0,0,0,0,0,0,0,0,0,0,0,0,0,0,0,0,0,0,0,0,0,0,0,0,0,0,0,0,0,0,0,0,0,0,0,0
IRON RED OXIDE USED AS PIGMENT,"CATUNEANU, R; BEJAN, C; STOICA, L; BOTEZATU, A",,,,REVISTA DE CHIMIE,1985,1985,36,6,,,,518,522,,,,,0,0,0,0,0,0,0,0,0,0,0,0,0,0,0,0,0,0,0,0,0,0,0,0,0,0,0,0,0,0,0,0,0,0,0,0,0,0,0,0,0,0,0,0,0,0,0,0,0,0,0
DETERMINATION OF SOME ORGANIC VAPORS FROM INDUSTRIAL ATMOSPHERE BY USING A HYGROACTIVE INDIVIDUAL COLLECTOR-264,"CIUPE, R; FAGARASAN, E; POP, L",,,,REVISTA DE CHIMIE,1985,1985,36,3,,,,264,267,,,,,0,0,0,0,0,0,0,0,0,0,0,0,0,0,0,0,0,0,0,0,0,0,0,0,0,0,0,0,0,0,0,0,0,0,0,0,0,0,0,0,0,0,0,0,0,0,0,0,0,0,0
ECOPHYSIOLOGICAL ASPECTS OF THE NON-AEROBIC DEGRADATION OF ORGANIC-MATTER,"COCHECI, V; CRAIU, C; PRISTAVU, N",,,,REVISTA DE CHIMIE,1985,1985,36,2,,,,117,119,,,,,0,0,0,0,0,0,0,0,0,0,0,0,0,0,0,0,0,0,0,0,0,0,0,0,0,0,0,0,0,0,0,0,0,0,0,0,0,0,0,0,0,0,0,0,0,0,0,0,0,0,0
ENERGETIC SELF-CONSUMPTION IN CONVENTIONAL ANAEROBIC DIGESTERS,"CRAIU, C; MATEI, E; ANGELESCU, I; PRESECAN, S",,,,REVISTA DE CHIMIE,1985,1985,36,7,,,,624,627,,,,,0,0,0,0,0,0,0,0,0,0,0,0,0,0,0,0,0,0,0,0,0,0,0,0,0,0,0,0,0,0,0,0,0,0,0,0,0,0,0,0,0,0,0,0,0,0,0,0,0,0,0
THE ROENTGEN-STRUCTURAL METHOD OF DETERMINING THE EXCHANGE DEGREE OF NA+ WITH CA2+ IN A-TYPE ZEOLITES,"CRISAN, D; TOMA, Z; ZAHARESCU, M; CRISAN, M",,,,REVISTA DE CHIMIE,1985,1985,36,5,,,,461,462,,,,,0,0,0,0,0,0,0,0,0,0,0,0,0,0,0,0,0,0,0,0,0,0,0,0,0,0,0,0,0,0,0,0,0,0,0,0,0,0,0,0,0,0,0,0,0,0,0,0,0,0,0
SPECTROPHOTOMETRIC METHOD FOR DETERMINING THE DEGREE OF ELECTROCHEMICAL REDUCTION OF PARA-NITROBENZOIC ACID TO PARA-AMINOBENZOIC ACID,"DANCIU, V; SILBERG, IA; ONICIU, L",,,,REVISTA DE CHIMIE,1985,1985,36,3,,,,243,246,,,,,0,0,0,0,0,0,0,0,0,0,0,0,0,0,0,0,0,0,0,0,0,0,0,0,0,0,0,0,0,0,0,0,0,0,0,0,0,0,0,0,0,0,0,0,0,0,0,0,0,0,0
ELECTROLYSIS OF TITANIUM CHLORIDE IN MELTED SALTS,"DINU, M",,,,REVISTA DE CHIMIE,1985,1985,36,2,,,,145,149,,,,,0,0,0,0,0,0,0,0,0,0,0,0,0,0,0,0,0,0,0,0,0,0,0,0,0,0,0,0,0,0,0,0,0,0,0,0,0,0,0,0,0,0,0,0,0,0,0,0,0,0,0
NEW FILM PRODUCTS FOR ANTICORROSION PROTECTION,"DODON, V; SEHTER, IN; LUCA, M; BOGDANOVA, TI; POPESCU, R; KOROH, NI",,,,REVISTA DE CHIMIE,1985,1985,36,10,,,,942,945,,,,,0,0,0,0,0,0,0,0,0,0,0,0,0,0,0,0,0,0,0,0,0,0,0,0,0,0,0,0,0,0,0,0,0,0,0,0,0,0,0,0,0,0,0,0,0,0,0,0,0,0,0
PHYSICOCHEMICAL PROPERTIES OF ALUMINA PROMOTED WITH METALLIC DIOXIDES .10. CHARACTERIZATION OF SOME ALUMINA AND AL2O3-CEO2 PREPARED IN THE PRESENCE OF ETHANEDIOL,"DULAMITA, N",,,,REVISTA DE CHIMIE,1985,1985,36,9,,,,823,831,,,,,0,0,0,0,0,0,0,0,0,0,0,0,0,0,0,0,0,0,0,0,0,0,0,0,0,0,0,0,0,0,0,0,0,0,0,0,0,0,0,0,0,0,0,0,0,0,0,0,0,0,0
EMISSION-SPECTROMETRY IN PLASMA,"DUMITRESCU, P; ZUGRAVESCU, PG; MANOLIU, C",,,,REVISTA DE CHIMIE,1985,1985,36,10,,,,946,953,,,,,0,0,0,0,0,0,0,0,0,0,0,0,0,0,0,0,0,0,0,0,0,0,0,0,0,0,0,0,0,0,0,0,0,0,0,0,0,0,0,0,0,0,0,0,0,0,0,0,0,0,0
DETERMINATION OF TRIFLUOPERAZINE NONPOLAR METABOLITES BY MASS-SPECTROMETRY,"FAGARASAN, M; FAGARASAN, E; OPREAN, I",,,,REVISTA DE CHIMIE,1985,1985,36,6,,,,556,557,,,,,0,0,0,0,0,0,0,0,0,0,0,0,0,0,0,0,0,0,0,0,0,0,0,0,0,0,0,0,0,0,0,0,0,0,0,0,0,0,0,0,0,0,0,0,0,0,0,0,0,0,0
METHOD AND LAB PLANT FOR THE PREPARATION OF LITHIUM DEUTERATED,"FARCASANU, M; MARAZAN, N",,,,REVISTA DE CHIMIE,1985,1985,36,9,,,,849,851,,,,,0,0,0,0,0,0,0,0,0,0,0,0,0,0,0,0,0,0,0,0,0,0,0,0,0,0,0,0,0,0,0,0,0,0,0,0,0,0,0,0,0,0,0,0,0,0,0,0,0,0,0
MACROKINETIC MODELING OF THE INDUSTRIAL-PROCESS OF ELECTROLYSIS OF CONCENTRATED SODIUM-CHLORIDE SOLUTIONS BY THE MERCURY CATODE METHOD .1. MODELING OF ANODIC PROCESS,"FILIP, RI; FILIP, V; CALISTRU, C",,,,REVISTA DE CHIMIE,1985,1985,36,5,,,,423,429,,,,,0,0,0,0,0,0,0,0,0,0,0,0,0,0,0,0,0,0,0,0,0,0,0,0,0,0,0,0,0,0,0,0,0,0,0,0,0,0,0,0,0,0,0,0,0,0,0,0,0,0,0
BIDIMENSIONAL MATHEMATICAL-MODEL OF THE MASS-TRANSFER IN CREEPING FLOW REGIME FROM A SPHERICAL DROPLET TO A LIQUID WITH VISCOUS-FLOW .1.,"FLOAREA, O; FLUIERASU, C; MIHAI, M",,,,REVISTA DE CHIMIE,1985,1985,36,10,,,,930,935,,,,,0,0,0,0,0,0,0,0,0,0,0,0,0,0,0,0,0,0,0,0,0,0,0,0,0,0,0,0,0,0,0,0,0,0,0,0,0,0,0,0,0,0,0,0,0,0,0,0,0,0,0
NEW TRENDS IN THE PROCESSES OF PURIFICATION AND TREATMENT OF WATERS AND RECOVERY OF USEFUL SUBSTANCES,"FLORESCU, M",,,,REVISTA DE CHIMIE,1985,1985,36,1,,,,9,12,,,,,0,0,0,0,0,0,0,0,0,0,0,0,0,0,0,0,0,0,0,0,0,0,0,0,0,0,0,0,0,0,0,0,0,0,0,0,0,0,0,0,0,0,0,0,0,0,0,0,0,0,0
USE OF ELIPSOMETRY IN THE STUDY OF GAS-ADSORPTION,"GARTNER, M; VASS, M",,,,REVISTA DE CHIMIE,1985,1985,36,7,,,,635,644,,,,,0,0,0,0,0,0,0,0,0,0,0,0,0,0,0,0,0,0,0,0,0,0,0,0,0,0,0,0,0,0,0,0,0,0,0,0,0,0,0,0,0,0,0,0,0,0,0,0,0,0,0
NON-COVENTIONAL TECHNOLOGIES IN OIL PROCESSING,"GRIGORIU, I; STEFANESCU, A; VELNICERIU, A; MANEA, G",,,,REVISTA DE CHIMIE,1985,1985,36,9,,,,793,801,,,,,0,0,0,0,0,0,0,0,0,0,0,0,0,0,0,0,0,0,0,0,0,0,0,0,0,0,0,0,0,0,0,0,0,0,0,0,0,0,0,0,0,0,0,0,0,0,0,0,0,0,0
KINETIC-MODEL FOR THE REACTION OF CATALYTIC HYDRODESALKYLATION OF C-9+ ALKYLAROMATIC COMPOUNDS IN THE PRESENCE OF TOLUENE AND PROCESSING ON COMPUTER,"IOAN, P",,,,REVISTA DE CHIMIE,1985,1985,36,9,,,,802,806,,,,,0,0,0,0,0,0,0,0,0,0,0,0,0,0,0,0,0,0,0,0,0,0,0,0,0,0,0,0,0,0,0,0,0,0,0,0,0,0,0,0,0,0,0,0,0,0,0,0,0,0,0
NEW TRISTHIOETHERS,"IOVU, M; BADAU, E",,,,REVISTA DE CHIMIE,1985,1985,36,10,,,,889,893,,,,,0,0,0,0,0,0,0,0,0,0,0,0,0,0,0,0,0,0,0,0,0,0,0,0,0,0,0,0,0,0,0,0,0,0,0,0,0,0,0,0,0,0,0,0,0,0,0,0,0,0,0
HEAT-TRANSFER AT THE BOILING OF PENTAERITRITE AND CALCIUM FORMIATE AQUEOUS-SOLUTIONS,"KOHN, D; MEDELEANU, M; SORA, M",,,,REVISTA DE CHIMIE,1985,1985,36,1,,,,65,66,,,,,0,0,0,0,0,0,0,0,0,0,0,0,0,0,0,0,0,0,0,0,0,0,0,0,0,0,0,0,0,0,0,0,0,0,0,0,0,0,0,0,0,0,0,0,0,0,0,0,0,0,0
SPLITTING OF N-TOSSIL LINK FROM AMINOPROTECTED PEPTIDES IN THE PRESENCE OF TRANSITIONAL METALS CHLORIDES,"LENTA, L; MENDEL, T; SZUCS, I; SCLIFOS, M; MATEI, S",,,,REVISTA DE CHIMIE,1985,1985,36,7,,,,671,672,,,,,0,0,0,0,0,0,0,0,0,0,0,0,0,0,0,0,0,0,0,0,0,0,0,0,0,0,0,0,0,0,0,0,0,0,0,0,0,0,0,0,0,0,0,0,0,0,0,0,0,0,0
"THE SYNERGETIC AGENT 1,1'-OXY-BIS(2,3,3,3-TETRACHLOROPROPANE) FOR PESTICIDES","LOWY, DA; SILBERG, IA; ONICIU, L",,,,REVISTA DE CHIMIE,1985,1985,36,1,,,,33,36,,,,,0,0,0,0,0,0,0,0,0,0,0,0,0,0,0,0,0,0,0,0,0,0,0,0,0,0,0,0,0,0,0,0,0,0,0,0,0,0,0,0,0,0,0,0,0,0,0,0,0,0,0
SPECTROPHOTOMETRIC METHOD FOR ANALYZING MIXTURES OF K2PTCL4 AND K2PTCL6,"MARTONY, L; MRACEC, M; BALINT, A; MAURER, A; SIMONESCU, T",,,,REVISTA DE CHIMIE,1985,1985,36,2,,,,154,156,,,,,0,0,0,0,0,0,0,0,0,0,0,0,0,0,0,0,0,0,0,0,0,0,0,0,0,0,0,0,0,0,0,0,0,0,0,0,0,0,0,0,0,0,0,0,0,0,0,0,0,0,0
IMPROVED TECHNOLOGY FOR TETRACYCLINE BIOSYNTHESIS,"MIU, I; SAUCIUC, A; CRACIUN, C; RUSU, L",,,,REVISTA DE CHIMIE,1985,1985,36,1,,,,26,28,,,,,0,0,0,0,0,0,0,0,0,0,0,0,0,0,0,0,0,0,0,0,0,0,0,0,0,0,0,0,0,0,0,0,0,0,0,0,0,0,0,0,0,0,0,0,0,0,0,0,0,0,0
GAS-LIQUID EQUILIBRIUM IN THE SYSTEM CO2-AQUEOUS SOLUTIONS OF K2CO3 (KHCO3) IN THE PRESENCE OF ACTIVATORS,"MUNTEAN, O; IONITA, L; IOVITA, C; SCHENKER, W",,,,REVISTA DE CHIMIE,1985,1985,36,7,,,,645,650,,,,,0,0,0,0,0,0,0,0,0,0,0,0,0,0,0,0,0,0,0,0,0,0,0,0,0,0,0,0,0,0,0,0,0,0,0,0,0,0,0,0,0,0,0,0,0,0,0,0,0,0,0
FUELS FROM BIOMASS .1. SYNTHETIC GASOLINE VIA CATALYTIC CONVERSION OF ETHYL-ALCOHOL OBTAINED BY PROCESSES WITH IMMOBILIZED CELLS,"MUSCA, G; POP, G; GIURCA, R; NICULESCU, S; IVANESCU, D; BRAGAREA, S",,,,REVISTA DE CHIMIE,1985,1985,36,7,,,,589,593,,,,,0,0,0,0,0,0,0,0,0,0,0,0,0,0,0,0,0,0,0,0,0,0,0,0,0,0,0,0,0,0,0,0,0,0,0,0,0,0,0,0,0,0,0,0,0,0,0,0,0,0,0
SINTERED CADMIUM ELECTRODES FOR NI-CD ALKALINE CELLS,"ONICIU, L; RUS, ME; CONSTANTIN, D; VOINA, V; ILEA, P",,,,REVISTA DE CHIMIE,1985,1985,36,9,,,,836,838,,,,,0,0,0,0,0,0,0,0,0,0,0,0,0,0,0,0,0,0,0,0,0,0,0,0,0,0,0,0,0,0,0,0,0,0,0,0,0,0,0,0,0,0,0,0,0,0,0,0,0,0,0
LOADING CAPACITY OF A COLUMN TYPE APPARATUS WITH EDGE UNLEVELING IN A CROSS MIDDLE WELDING,"PAVEL, A",,,,REVISTA DE CHIMIE,1985,1985,36,6,,,,543,548,,,,,0,0,0,0,0,0,0,0,0,0,0,0,0,0,0,0,0,0,0,0,0,0,0,0,0,0,0,0,0,0,0,0,0,0,0,0,0,0,0,0,0,0,0,0,0,0,0,0,0,0,0
EVALUATION OF THE VALIDITY DOMAIN OF KINETIC RELATIONS IN THE CASE OF SULFUR-DIOXIDE OXIDATION PROCESS .1. PROCESSING OF EXPERIMENTAL-DATA,"PINCOVSCHI, E; TUAN, NC; BELCU, M; ISOPESCU, A",,,,REVISTA DE CHIMIE,1985,1985,36,9,,,,818,822,,,,,0,0,0,0,0,0,0,0,0,0,0,0,0,0,0,0,0,0,0,0,0,0,0,0,0,0,0,0,0,0,0,0,0,0,0,0,0,0,0,0,0,0,0,0,0,0,0,0,0,0,0
EVALUATION OF THE VALIDITY RANGE OF KINETIC RELATIONS IN THE CASE OF SULFUR-DIOXIDE OXIDATION PROCESS .2. COMPARISON OF THE MAIN THEORETICAL-MODELS,"PINCOVSCHI, E; TUAN, NC; BELCU, M; ISOPESCU, A",,,,REVISTA DE CHIMIE,1985,1985,36,10,,,,906,910,,,,,0,0,0,0,0,0,0,0,0,0,0,0,0,0,0,0,0,0,0,0,0,0,0,0,0,0,0,0,0,0,0,0,0,0,0,0,0,0,0,0,0,0,0,0,0,0,0,0,0,0,0
CORROSION INHIBITION BY A MIXTURE OF QUATERNARY AMMONIA SALTS,"POPESCU, B; SOCOLESCU, A; ILIUTA, I",,,,REVISTA DE CHIMIE,1985,1985,36,6,,,,533,538,,,,,0,0,0,0,0,0,0,0,0,0,0,0,0,0,0,0,0,0,0,0,0,0,0,0,0,0,0,0,0,0,0,0,0,0,0,0,0,0,0,0,0,0,0,0,0,0,0,0,0,0,0
CORROSION INHIBITING EFFECT OF SOME AMMONIUM QUATERNARY-SALTS OF DIBUTYL PHOSPHATES TYPE,"POPESCU, B; SOCOLESCU, A; ILIUTA, I",,,,REVISTA DE CHIMIE,1985,1985,36,9,,,,845,848,,,,,0,0,0,0,0,0,0,0,0,0,0,0,0,0,0,0,0,0,0,0,0,0,0,0,0,0,0,0,0,0,0,0,0,0,0,0,0,0,0,0,0,0,0,0,0,0,0,0,0,0,0
DETERMINATION OF COMPOSITION AND STRUCTURE OF THE CO-MO/AL2O3 SYSTEM BY INFRARED SPECTROMETRY,"POPOIU, S; TOMA, C; KALMUTCHI, G; DUCA, A",,,,REVISTA DE CHIMIE,1985,1985,36,6,,,,515,517,,,,,0,0,0,0,0,0,0,0,0,0,0,0,0,0,0,0,0,0,0,0,0,0,0,0,0,0,0,0,0,0,0,0,0,0,0,0,0,0,0,0,0,0,0,0,0,0,0,0,0,0,0
DETERMINATION OF THE OPTIMUM WORKING-CONDITIONS AT THE OXIDATION OF POTASSIUM FERROCYANIDE IN ELECTROLYZER WITHOUT DIAPHRAGM,"RADOI, I; DRAGOS, S; DEAKY, A",,,,REVISTA DE CHIMIE,1985,1985,36,1,,,,37,41,,,,,0,0,0,0,0,0,0,0,0,0,0,0,0,0,0,0,0,0,0,0,0,0,0,0,0,0,0,0,0,0,0,0,0,0,0,0,0,0,0,0,0,0,0,0,0,0,0,0,0,0,0
PREPARATION OF HYDROQUINONE FROM BENZENE BY ELECTROCHEMICAL ROUTE,"RADOI, I; VASZILCSIN, N; SERENGAU, O",,,,REVISTA DE CHIMIE,1985,1985,36,2,,,,112,116,,,,,0,0,0,0,0,0,0,0,0,0,0,0,0,0,0,0,0,0,0,0,0,0,0,0,0,0,0,0,0,0,0,0,0,0,0,0,0,0,0,0,0,0,0,0,0,0,0,0,0,0,0
PESTICIDE ACTIVITY OF FAT ALCOHOLS,"RADU, M; TUDOSESCU, V; DOBRE, E; STOIANOVICI, L",,,,REVISTA DE CHIMIE,1985,1985,36,7,,,,613,616,,,,,0,0,0,0,0,0,0,0,0,0,0,0,0,0,0,0,0,0,0,0,0,0,0,0,0,0,0,0,0,0,0,0,0,0,0,0,0,0,0,0,0,0,0,0,0,0,0,0,0,0,0
"REACTIONS OF NICKEL AND COBALT IONS WITH THE 1-(2-HYDROXY-3,6-DISULPHONAPHTYLASE)-1-PHENYL-2-CARBOXYLIC ACID","STEFANCU, E; STEFANCU, D",,,,REVISTA DE CHIMIE,1985,1985,36,9,,,,863,864,,,,,0,0,0,0,0,0,0,0,0,0,0,0,0,0,0,0,0,0,0,0,0,0,0,0,0,0,0,0,0,0,0,0,0,0,0,0,0,0,0,0,0,0,0,0,0,0,0,0,0,0,0
ECONOMIC TURNING TO GOOD ACCOUNT OF WASTED GASES RESULTED FROM NH3 SYNTHESIS,"STENZEL, G; SCHMIDT, K",,,,REVISTA DE CHIMIE,1985,1985,36,3,,,,229,232,,,,,0,0,0,0,0,0,0,0,0,0,0,0,0,0,0,0,0,0,0,0,0,0,0,0,0,0,0,0,0,0,0,0,0,0,0,0,0,0,0,0,0,0,0,0,0,0,0,0,0,0,0
PROCESSING OF VEGETAL OILS,"STOICA, R; ARITON, AM; TOPORAN, A",,,,REVISTA DE CHIMIE,1985,1985,36,7,,,,597,602,,,,,0,0,0,0,0,0,0,0,0,0,0,0,0,0,0,0,0,0,0,0,0,0,0,0,0,0,0,0,0,0,0,0,0,0,0,0,0,0,0,0,0,0,0,0,0,0,0,0,0,0,0
CO2 STRIPPING FROM THE MONOETHANOLAMINE SOLUTION RESULTED FROM THE PROCESS OF HYDROGEN PURIFICATION,"STRATULA, C; VITOS, A; PETROV, M",,,,REVISTA DE CHIMIE,1985,1985,36,1,,,,42,44,,,,,0,0,0,0,0,0,0,0,0,0,0,0,0,0,0,0,0,0,0,0,0,0,0,0,0,0,0,0,0,0,0,0,0,0,0,0,0,0,0,0,0,0,0,0,0,0,0,0,0,0,0
STUDY OF THE NITROPHOSPHATES PREPARATION PROCESS .1. THERMAL-PROPERTIES OF THE SYNTHETIC SOLUTIONS,"TALABA, M; AELENEI, N; HAGIU, C; TALABA, A",,,,REVISTA DE CHIMIE,1985,1985,36,2,,,,150,153,,,,,0,0,0,0,0,0,0,0,0,0,0,0,0,0,0,0,0,0,0,0,0,0,0,0,0,0,0,0,0,0,0,0,0,0,0,0,0,0,0,0,0,0,0,0,0,0,0,0,0,0,0
CALCULUS METHOD FOR THE ATMOSPHERIC STORAGE TANKS,"TEODORESCU, S",,,,REVISTA DE CHIMIE,1985,1985,36,5,,,,452,459,,,,,0,0,0,0,0,0,0,0,0,0,0,0,0,0,0,0,0,0,0,0,0,0,0,0,0,0,0,0,0,0,0,0,0,0,0,0,0,0,0,0,0,0,0,0,0,0,0,0,0,0,0
MASS-TRANSFER INCREASING IN THE RECTIFICATION OPERATION,"TUDOSE, RZ; HOROBA, L; BALACEANU, V; BALACEANU, M; GRIGORAS, C; GROZA, M",,,,REVISTA DE CHIMIE,1985,1985,36,7,,,,651,655,,,,,0,0,0,0,0,0,0,0,0,0,0,0,0,0,0,0,0,0,0,0,0,0,0,0,0,0,0,0,0,0,0,0,0,0,0,0,0,0,0,0,0,0,0,0,0,0,0,0,0,0,0
SYNTHESIS OF 4'-AMINOBENZANYLIDE AND OF SOME DERIVED DYESTUFFS,"URSEANU, F; TERCIU, N; LUCHIAN, A; DRAGHICI, C; UDREA, D",,,,REVISTA DE CHIMIE,1985,1985,36,6,,,,490,495,,,,,0,0,0,0,0,0,0,0,0,0,0,0,0,0,0,0,0,0,0,0,0,0,0,0,0,0,0,0,0,0,0,0,0,0,0,0,0,0,0,0,0,0,0,0,0,0,0,0,0,0,0
