Title,Authors,Corporate Authors,Editors,Book Editors,Source Title,Publication Date,Publication Year,Volume,Issue,Part Number,Supplement,Special Issue,Beginning Page,Ending Page,Article Number,DOI,Conference Title,Conference Date,Total Citations,Average per Year,1975,1976,1977,1978,1979,1980,1981,1982,1983,1984,1985,1986,1987,1988,1989,1990,1991,1992,1993,1994,1995,1996,1997,1998,1999,2000,2001,2002,2003,2004,2005,2006,2007,2008,2009,2010,2011,2012,2013,2014,2015,2016,2017,2018,2019,2020,2021,2022,2023
"CORRELATION BETWEEN COMPOSITIES, VISCOSIMETRIC MOLECULAR-WEIGHT AND SYNTHESIS CONDITIONS FOR CERTAIN MALEIC-ANHYDRIDE VINYL-ACETATE COPOLYMERS","BELDIE, C; POPA, I; CHITANU, G",,,,MATERIALE PLASTICE,1995,1995,32,1,,,,31,37,,,,,1,0.03,0,0,0,0,0,0,0,0,0,0,0,0,0,0,0,0,0,0,0,0,0,0,0,0,0,0,0,0,0,0,0,1,0,0,0,0,0,0,0,0,0,0,0,0,0,0,0,0,0
POLYAMINOCHLOROQUINONE .1. CHLORANIL SOLUTION POLYCONDENSATION WITH BENZADINE OR PIPERAZIDINE,"BUTUFEI, O; MAZARE, M",,,,MATERIALE PLASTICE,1995,1995,32,1,,,,12,19,,,,,1,0.03,0,0,0,0,0,0,0,0,0,0,0,0,0,0,0,0,0,0,0,0,1,0,0,0,0,0,0,0,0,0,0,0,0,0,0,0,0,0,0,0,0,0,0,0,0,0,0,0,0
THE EFFECT OF SOME LEWIS-BASES UPON THE MICROSTRUCTURE OF THE POLYISOPRENE SYNTHESIZED BY ANIONIC-POLYMERIZATION WITH N-BUTYLLITHIUM,"BUZDUGAN, E; GHIOCA, P",,,,MATERIALE PLASTICE,1995,1995,32,2,,,,127,132,,,,,1,0.03,0,0,0,0,0,0,0,0,0,0,0,0,0,0,0,0,0,0,0,0,0,0,0,0,0,0,0,0,0,0,0,0,1,0,0,0,0,0,0,0,0,0,0,0,0,0,0,0,0
"BENZENIC STRUCTURES ON MACROMOLECULAR CHAINS .8. CYCLIC POLYUREAS FROM 2,2'-DIBENZYLDIISOCYANATE","CARACULACU, AA; MISINA, L",,,,MATERIALE PLASTICE,1995,1995,32,1,,,,38,44,,,,,1,0.03,0,0,0,0,0,0,0,0,0,0,0,0,0,0,0,0,0,0,0,0,0,1,0,0,0,0,0,0,0,0,0,0,0,0,0,0,0,0,0,0,0,0,0,0,0,0,0,0,0
CHROME COMPLEX ANIONS (III) IN CHEMICAL-ANALYSIS - BISMUTH DETERMINATION AS HEXATHIOCYANATOCHROMATE,"GANESCU, I; RUSU, O; MURESEANU, M; CHIRIGIU, L",,,,REVISTA DE CHIMIE,JAN 1995,1995,46,1,,,,70,75,,,,,1,0.03,0,0,0,0,0,0,0,0,0,0,0,0,0,0,0,0,0,0,0,0,0,0,0,0,0,0,0,1,0,0,0,0,0,0,0,0,0,0,0,0,0,0,0,0,0,0,0,0,0
STYRENE-BUTADIENE BLOCK-COPOLYMERS COMPOUNDS WITH ACRYLATES,"GHIOCA, P; BUZDUGAN, E; SERBAN, S; STRIBECK, N; ZACHMAN, HG",,,,MATERIALE PLASTICE,1995,1995,32,1,,,,45,53,,,,,1,0.03,0,0,0,0,0,0,0,0,0,0,0,0,0,0,0,0,0,0,0,0,0,0,0,0,0,0,1,0,0,0,0,0,0,0,0,0,0,0,0,0,0,0,0,0,0,0,0,0,0
ANTIDEGRADANTS CONSUMPTION FROM THE VULCANIZED COMPOSITIONS,"GIURGINCA, M; NICOLESCU, DN",,,,MATERIALE PLASTICE,1995,1995,32,2,,,,143,149,,,,,1,0.03,0,0,0,0,0,0,0,0,0,0,0,0,0,0,0,0,0,0,0,0,0,0,0,0,0,0,0,0,1,0,0,0,0,0,0,0,0,0,0,0,0,0,0,0,0,0,0,0,0
ADSORPTION PROCESS OF SOME POLYETHOXYLATED ALKYLPHOSPHORIC ESTERS ON FIBER SURFACE,"SANDESCU, F",,,,MATERIALE PLASTICE,1995,1995,32,1,,,,65,68,,,,,1,0.03,0,0,0,0,0,0,0,0,0,0,0,0,0,0,0,0,0,0,0,0,0,0,1,0,0,0,0,0,0,0,0,0,0,0,0,0,0,0,0,0,0,0,0,0,0,0,0,0,0
ANTICORROSIVE MATERIALS RESISTANT IN INDUSTRIAL MEDIUM,"VASILESCU, E; DROB, P",,,,REVISTA DE CHIMIE,JAN 1995,1995,46,1,,,,76,79,,,,,1,0.03,0,0,0,0,0,0,0,0,0,0,0,0,0,0,0,0,0,0,0,0,0,0,0,0,0,1,0,0,0,0,0,0,0,0,0,0,0,0,0,0,0,0,0,0,0,0,0,0,0
THERMAL-DEGRADATION OF THE ETHYLENE - PROPYLENE ELASTOMERS IN THE PRESENCE OF POLYSTYRENE AND SOME FIREPROOFED MATERIALS,"ZAHARESCU, T",,,,MATERIALE PLASTICE,1995,1995,32,2,,,,138,142,,,,,1,0.03,0,0,0,0,0,0,0,0,0,0,0,0,0,0,0,0,0,0,0,0,0,0,0,0,0,0,1,0,0,0,0,0,0,0,0,0,0,0,0,0,0,0,0,0,0,0,0,0,0
"REACTIVE QUINOXALINE DYES .1. 2,3-DIHYDROXY-QUINOXALINE-6-CARBOXYLIC ACID SYNTHESIS","BOC, I; MACARIE, I; PALEA, R",,,,REVISTA DE CHIMIE,NOV 1994,1994,45,11,,,,965,969,,,,,1,0.03,0,0,0,0,0,0,0,0,0,0,0,0,0,0,0,0,0,0,0,0,0,0,0,0,0,0,0,0,0,0,1,0,0,0,0,0,0,0,0,0,0,0,0,0,0,0,0,0,0
"MODERN, RMN TECHNIQUES USED IN DETERMINING THE ORGANIC-COMPOUNDS STRUCTURE","KOVACS, D; CRISTEA, C",,,,REVISTA DE CHIMIE,NOV 1994,1994,45,11,,,,988,999,,,,,1,0.03,0,0,0,0,0,0,0,0,0,0,0,0,0,0,0,0,0,0,0,0,0,0,0,0,0,0,0,0,0,1,0,0,0,0,0,0,0,0,0,0,0,0,0,0,0,0,0,0,0
A STUDY OF THE DIVALENT METALS TETRANAPHTHYL-PORPHINATES PHOTOSENSITIZING EFFECT,"ION, RM",,,,REVISTA DE CHIMIE,SEP 1994,1994,45,9,,,,827,828,,,,,1,0.03,0,0,0,0,0,0,0,0,0,0,0,0,0,0,0,0,0,0,0,0,0,0,0,1,0,0,0,0,0,0,0,0,0,0,0,0,0,0,0,0,0,0,0,0,0,0,0,0,0
"LIQUID-VAPOR-EQUILIBRIUM DATA IN THE BINARY-SYSTEMS MADE UP OF ETHANOL, I-PROPANOL AND ACETALDEHYDE DIETHYLACETATE","IONESCU, I; CIOROIANU, D; SAVESCU, V",,,,REVISTA DE CHIMIE,SEP 1994,1994,45,9,,,,803,807,,,,,1,0.03,0,0,0,0,0,0,0,0,0,0,0,0,0,0,0,0,0,0,0,0,0,0,0,0,0,0,0,0,0,0,0,0,0,0,0,0,0,0,0,0,0,0,0,0,0,0,1,0,0
"ELECTRIC TRANSPORT PHENOMENA, SPECIFIC TO THE COMPLEX, MXHGI4- TYPE COMBINATIONS .4.","ROSU, T; NEGOIU, D",,,,REVISTA DE CHIMIE,SEP 1994,1994,45,9,,,,797,802,,,,,1,0.03,0,0,0,0,0,0,0,0,0,0,0,0,0,0,0,0,0,0,0,0,1,0,0,0,0,0,0,0,0,0,0,0,0,0,0,0,0,0,0,0,0,0,0,0,0,0,0,0,0
SULFUR ORES TURNING TO GOOD VALUE .7. MODELING THE SULFUR BURNING FROM THE INDIVIDUAL PARTICLES OF THE VOLCANIC ORIGIN ORES,"DIMA, R; FLOAREA, O; BARBU, E",,,,REVISTA DE CHIMIE,AUG 1994,1994,45,8,,,,687,694,,,,,1,0.03,0,0,0,0,0,0,0,0,0,0,0,0,0,0,0,0,0,0,0,1,0,0,0,0,0,0,0,0,0,0,0,0,0,0,0,0,0,0,0,0,0,0,0,0,0,0,0,0,0
"BRATU,EMILIAN,A. - FOUNDER OF ROMANIAN CHEMICAL-ENGINEERING","JINESCU, G",,,,REVISTA DE CHIMIE,AUG 1994,1994,45,8,,,,643,647,,,,,1,0.03,0,0,0,0,0,0,0,0,0,0,0,0,0,0,0,0,0,0,0,0,0,0,0,0,0,0,0,0,0,0,0,0,0,0,0,0,0,0,0,0,1,0,0,0,0,0,0,0,0
A KINETIC-ANALYTICAL STUDY OF THE ORANGE G-POTASSIUM BROMATE-VANADIUM IONS REACTION,"COSTACHE, D",,,,REVISTA DE CHIMIE,JUL 1994,1994,45,7,,,,611,613,,,,,1,0.03,0,0,0,0,0,0,0,0,0,0,0,0,0,0,0,0,0,0,0,0,0,1,0,0,0,0,0,0,0,0,0,0,0,0,0,0,0,0,0,0,0,0,0,0,0,0,0,0,0
AN EXPERIMENTAL-STUDY ON THE ALKYL-CYANAMINE PHOSPHATES AND BORATES INHIBITION EFFICIENCY UPON THE HYDROCHLORIC CORROSION,"CRETU, S; VISAN, S",,,,REVISTA DE CHIMIE,JUL 1994,1994,45,7,,,,620,625,,,,,1,0.03,0,0,0,0,0,0,0,0,0,0,0,0,0,0,0,0,0,0,0,0,0,0,0,1,0,0,0,0,0,0,0,0,0,0,0,0,0,0,0,0,0,0,0,0,0,0,0,0,0
SULFUR ORES TURNING TO HIGH VALUE .5. DIRECT BURNING OF THE SULFUR ORE IN MOBIL LAYER,"DIMA, R; FLOAREA, O",,,,REVISTA DE CHIMIE,JUL 1994,1994,45,7,,,,583,587,,,,,1,0.03,0,0,0,0,0,0,0,0,0,0,0,0,0,0,0,0,0,0,0,1,0,0,0,0,0,0,0,0,0,0,0,0,0,0,0,0,0,0,0,0,0,0,0,0,0,0,0,0,0
"EQUIMOLECULAR COMPOSITION P2O5-SIO2 CATALYST ACTIVITY IN THE 4-4'-DIMETHYL-1,3-METADIOXANE DECOMPOSITION REACTION TO ISOPRENE .4.","AVRAMESCU, F",,,,REVISTA DE CHIMIE,JUN 1994,1994,45,6,,,,455,458,,,,,1,0.03,0,0,0,0,0,0,0,0,0,0,0,0,0,0,0,0,0,0,0,0,0,1,0,0,0,0,0,0,0,0,0,0,0,0,0,0,0,0,0,0,0,0,0,0,0,0,0,0,0
"KINETIC CONSTANTS DETERMINATION OF SOME RADICALS REACTIONS TO D-GLUCOSE, BY THE LYOLUMINISCENCE METHOD","MIHALCEA, I; JIPA, S; SETNESCU, T; SETNESCU, R; DINCA, D",,,,REVISTA DE CHIMIE,JUN 1994,1994,45,6,,,,463,467,,,,,1,0.03,0,0,0,0,0,0,0,0,0,0,0,0,0,0,0,0,0,0,0,0,0,0,0,0,0,0,0,0,0,0,1,0,0,0,0,0,0,0,0,0,0,0,0,0,0,0,0,0,0
"COMPLEX COMBINATIONS RELATED BY ELECTRON-TRANSFER REACTIONS - CU(II) AND NI(II) METALLIC COMPLEXES WITH 5-HYDROXY-6-MERCAPTO-7,8-BENZO-PHENAZINE","PLENICEANU, M; MURESAN, M",,,,REVISTA DE CHIMIE,JUN 1994,1994,45,6,,,,511,514,,,,,1,0.03,0,0,0,0,0,0,0,0,0,0,0,0,0,0,0,0,0,0,0,0,1,0,0,0,0,0,0,0,0,0,0,0,0,0,0,0,0,0,0,0,0,0,0,0,0,0,0,0,0
1-NAPHTHOL PRODUCTION FROM TETRALINE .2. TETRALINE CATALYTIC-OXIDATION TO 1-TETRALONE - KINETIC CONSTANTS DETERMINATION,"CALINESCU, I; AVRAM, R; IOVU, H",,,,REVISTA DE CHIMIE,APR 1994,1994,45,4,,,,299,305,,,,,1,0.03,0,0,0,0,0,0,0,0,0,0,0,0,0,0,0,0,0,0,0,0,0,0,0,0,0,0,0,0,0,0,0,0,0,0,0,0,0,0,0,0,0,1,0,0,0,0,0,0,0
CORROSION - BEHAVIOR OF SOME METALS IN IMPURIFIED ALCOHOLS .1. FORMIC-ACID IMPURIFIER,"NICOLA, M; BADEA, T",,,,REVISTA DE CHIMIE,APR 1994,1994,45,4,,,,342,346,,,,,1,0.03,0,0,0,0,0,0,0,0,0,0,0,0,0,0,0,0,0,0,0,1,0,0,0,0,0,0,0,0,0,0,0,0,0,0,0,0,0,0,0,0,0,0,0,0,0,0,0,0,0
SYNTHESIS OF DIKETONES AND DIAROYLALKANES DERIVATIVES,"CALIN, CG; BARBULESCU, E; STOIANOVICI, L",,,,REVISTA DE CHIMIE,FEB 1994,1994,45,2,,,,89,96,,,,,1,0.03,0,0,0,0,0,0,0,0,0,0,0,0,0,0,0,0,0,0,0,0,0,0,0,0,1,0,0,0,0,0,0,0,0,0,0,0,0,0,0,0,0,0,0,0,0,0,0,0,0
"FLOW-INJECTION ANALYSIS APPLIED TO FE, CO, NI AND CU - DETERMINATIONS BY ATOMIC-ABSORPTION SPECTROPHOTOMETRY","DANET, AF; PISOSCHI, A; CHEREGI, M",,,,REVISTA DE CHIMIE,FEB 1994,1994,45,2,,,,135,141,,,,,1,0.03,0,0,0,0,0,0,0,0,0,0,0,0,0,0,0,0,0,0,0,0,0,0,0,0,0,0,0,0,0,0,0,0,0,0,0,0,0,0,0,0,0,1,0,0,0,0,0,0,0
THE OPTIMUM WALL THICKNESS OF THE EXTRUDER BARREL .1. THE CIRCULAR STIFFNESS OF THE BARREL,"TEODORESCU, N",,,,REVISTA DE CHIMIE,FEB 1994,1994,45,2,,,,142,150,,,,,1,0.03,0,0,0,0,0,0,0,0,0,0,0,0,0,0,0,0,0,0,0,1,0,0,0,0,0,0,0,0,0,0,0,0,0,0,0,0,0,0,0,0,0,0,0,0,0,0,0,0,0
"SOLID-LIQUID INTERFACE TRANSFER CATALYSIS, WITHOUT SOLVENT ADDITION","VLASSA, M; KEZDI, M; POJARFENESAN, M; MOLNARIU, C",,,,REVISTA DE CHIMIE,FEB 1994,1994,45,2,,,,127,134,,,,,1,0.03,0,0,0,0,0,0,0,0,0,0,0,0,0,0,0,0,0,0,0,0,0,0,0,0,0,0,0,0,0,0,0,0,0,0,0,1,0,0,0,0,0,0,0,0,0,0,0,0,0
TENDENCIES IN CAR GASOLINES MANUFACTURE .1. REFORMULATED GASOLINES PREPARATION,"ANGHELACHE, I",,,,REVISTA DE CHIMIE,JAN 1994,1994,45,1,,,,5,13,,,,,1,0.03,0,0,0,0,0,0,0,0,0,0,0,0,0,0,0,0,0,0,0,0,0,1,0,0,0,0,0,0,0,0,0,0,0,0,0,0,0,0,0,0,0,0,0,0,0,0,0,0,0
"EDELEANU,LAZAR - A FORERUNNER OF THE PETROCHEMICAL INDUSTRY","COCIASU, CA",,,,REVISTA DE CHIMIE,JAN 1994,1994,45,1,,,,74,77,,,,,1,0.03,0,0,0,0,0,0,0,0,0,0,0,0,0,0,0,0,0,0,0,0,0,0,0,0,0,0,0,0,0,0,0,0,0,1,0,0,0,0,0,0,0,0,0,0,0,0,0,0,0
"SELECTIVE CD2+-MEMBRANE ELECTRODE, EMIS-CD .2. ELECTRODE SELECTIVITY AND RESPONSE TO COMPLEXING AGENTS","HOPIRTEAN, E; COSMA, V",,,,REVISTA DE CHIMIE,JAN 1994,1994,45,1,,,,64,67,,,,,1,0.03,0,0,0,0,0,0,0,0,0,0,0,0,0,0,0,0,0,0,0,1,0,0,0,0,0,0,0,0,0,0,0,0,0,0,0,0,0,0,0,0,0,0,0,0,0,0,0,0,0
DEXTRANE 2000-5000 OXIDATION WITH ELECTROCHEMICALLY GENERATED IODINE,"FAGADARCOSMA, G; RADOI, I",,,,REVISTA DE CHIMIE,NOV 1993,1993,44,11,,,,961,967,,,,,1,0.03,0,0,0,0,0,0,0,0,0,0,0,0,0,0,0,0,0,0,0,0,0,0,0,0,1,0,0,0,0,0,0,0,0,0,0,0,0,0,0,0,0,0,0,0,0,0,0,0,0
CONTRIBUTION TO THE MASS AND ENERGETIC BALANCE IN ELECTROCHEMICAL GRINDING,"GUTT, S; GUTT, G",,,,REVISTA DE CHIMIE,NOV 1993,1993,44,11,,,,972,977,,,,,1,0.03,0,0,0,0,0,0,0,0,0,0,0,0,0,0,0,0,0,0,0,0,0,0,0,0,0,0,0,0,0,0,0,0,0,0,0,1,0,0,0,0,0,0,0,0,0,0,0,0,0
THE INFLUENCE OF THE MIXING DEGREE UPON THE LIQUID-PHASE PNEUMATIC RECYCLING BIOREACTOR PERFORMANCE,"JINESCU, G; LAVRIC, V",,,,REVISTA DE CHIMIE,AUG 1993,1993,44,8,,,,750,756,,,,,1,0.03,0,0,0,0,0,0,0,0,0,0,0,0,0,0,0,0,0,0,0,0,0,0,0,0,0,0,0,0,0,1,0,0,0,0,0,0,0,0,0,0,0,0,0,0,0,0,0,0,0
OPPORTUNITIES FOR MANUFACTURING AND USING UNLEADED GASOLINE IN ROMANIA,"MANEA, G",,,,REVISTA DE CHIMIE,AUG 1993,1993,44,8,,,,699,703,,,,,1,0.03,0,0,0,0,0,0,0,0,0,0,0,0,0,0,0,0,0,0,0,0,0,1,0,0,0,0,0,0,0,0,0,0,0,0,0,0,0,0,0,0,0,0,0,0,0,0,0,0,0
CO(III) COMPLEXES WITH SULFAMIDE AND SULFATHIAZOLE,"VATULESCU, R; BUDIU, T; SILBERG, I",,,,REVISTA DE CHIMIE,AUG 1993,1993,44,8,,,,712,718,,,,,1,0.03,0,0,0,0,0,0,0,0,0,0,0,0,0,0,0,0,0,0,0,0,0,0,0,0,0,0,1,0,0,0,0,0,0,0,0,0,0,0,0,0,0,0,0,0,0,0,0,0,0
DUST RETENTION FROM GASES BY MOBILE LAYER WASHING,"DOBRE, T; FLOAREA, O",,,,REVISTA DE CHIMIE,JUL 1993,1993,44,7,,,,657,663,,,,,1,0.03,0,0,0,0,0,0,0,0,0,0,0,0,0,0,0,0,0,0,0,0,0,0,0,0,0,0,0,0,0,0,0,0,0,1,0,0,0,0,0,0,0,0,0,0,0,0,0,0,0
"A STUDY OF THE COPPER, NICKEL AND STANIUM ELECTRODEPOSITION ON SNO2 - BASED SEMICONDUCTOR CERAMIC SUPPORT","GALASIU, I; GALASIU, R",,,,REVISTA DE CHIMIE,JUL 1993,1993,44,7,,,,639,642,,,,,1,0.03,0,0,0,0,0,0,0,0,0,0,0,0,0,0,0,0,0,0,0,0,0,0,1,0,0,0,0,0,0,0,0,0,0,0,0,0,0,0,0,0,0,0,0,0,0,0,0,0,0
PRECIPITATION CONDITIONS INFLUENCE UPON THE NICKEL REDUCTION DEGREE IN THE NIO-AL2O3 CATALYSTS,"BLEJOIU, SI; OSICEANU, P; STANICA, N; VASS, M; CIOROIANU, T; VADEANU, V",,,,REVISTA DE CHIMIE,JUN 1993,1993,44,6,,,,546,551,,,,,1,0.03,0,0,0,0,0,0,0,0,0,0,0,0,0,0,0,0,0,0,0,0,0,0,1,0,0,0,0,0,0,0,0,0,0,0,0,0,0,0,0,0,0,0,0,0,0,0,0,0,0
SYRINGALDEHYDE PRODUCTION AND ITS CHROMATOGRAPHIC DETERMINATION FROM AN NATURAL EXTRACT,"CONSTANTINESCU, T; POPESCU, DO; TUDOR, E; RADU, M",,,,REVISTA DE CHIMIE,JUN 1993,1993,44,6,,,,530,535,,,,,1,0.03,0,0,0,0,0,0,0,0,0,0,0,0,0,0,0,0,0,0,0,0,0,0,0,0,0,0,0,0,1,0,0,0,0,0,0,0,0,0,0,0,0,0,0,0,0,0,0,0,0
SIZING THE VERTICAL CONDENSERS DESTINED TO MULTICOMPONENT VAPOR MIXTURES,"FLOAREA, O; PARJOL, I",,,,REVISTA DE CHIMIE,JUN 1993,1993,44,6,,,,558,567,,,,,1,0.03,0,0,0,0,0,0,0,0,0,0,0,0,0,0,0,0,0,0,0,0,1,0,0,0,0,0,0,0,0,0,0,0,0,0,0,0,0,0,0,0,0,0,0,0,0,0,0,0,0
PETROLEUM RESIDUES RHEOLOGICAL PARAMETERS EVOLUTION,"IUTESPETRESCU, N; PLATON, A; IUTESPETRESCU, T",,,,REVISTA DE CHIMIE,JUN 1993,1993,44,6,,,,568,570,,,,,1,0.03,0,0,0,0,0,0,0,0,0,0,0,0,0,0,0,0,0,0,0,0,1,0,0,0,0,0,0,0,0,0,0,0,0,0,0,0,0,0,0,0,0,0,0,0,0,0,0,0,0
IONIC EXCHANGE ON NAX SYNTHETIC ZEOLITES IN THE PRESENCE OF SURFACTANTS,"VASILE, A; POPA, A; CRUCEANU, M; BOLD, A; POPOVICI, E",,,,REVISTA DE CHIMIE,JUN 1993,1993,44,6,,,,552,557,,,,,1,0.03,0,0,0,0,0,0,0,0,0,0,0,0,0,0,0,0,0,0,0,0,0,0,0,0,1,0,0,0,0,0,0,0,0,0,0,0,0,0,0,0,0,0,0,0,0,0,0,0,0
CU(II) COMPLEXES WITH SULPHATHLAZOLE,"BUDIU, T; VATULESCU, R; SILBERG, I",,,,REVISTA DE CHIMIE,MAY 1993,1993,44,5,,,,435,440,,,,,1,0.03,0,0,0,0,0,0,0,0,0,0,0,0,0,0,0,0,0,0,1,0,0,0,0,0,0,0,0,0,0,0,0,0,0,0,0,0,0,0,0,0,0,0,0,0,0,0,0,0,0
"STUDIES ON SEVERAL COMPOUNDS WITH SCHIFF-BASE - THE CO(II), NI(II), AND CU(II) - COMPLEXES WITH SCHIFF-BASE DERIVED FROM 5-FORMYLVANILLINE AND P-TOLUIDINE","SERBAN, I; SERBAN, V; NICOLAE, A; MAIOR, O; MEGHEA, A",,,,REVISTA DE CHIMIE,MAY 1993,1993,44,5,,,,441,445,,,,,1,0.03,0,0,0,0,0,0,0,0,0,0,0,0,0,0,0,0,0,0,1,0,0,0,0,0,0,0,0,0,0,0,0,0,0,0,0,0,0,0,0,0,0,0,0,0,0,0,0,0,0
KINETIC-STUDY OF THE REACTION SOLOCROM DARK BLUE-PEROXIDE-FE,"COSTACHE, D",,,,REVISTA DE CHIMIE,APR 1993,1993,44,4,,,,319,322,,,,,1,0.03,0,0,0,0,0,0,0,0,0,0,0,0,0,0,0,0,0,0,0,0,0,1,0,0,0,0,0,0,0,0,0,0,0,0,0,0,0,0,0,0,0,0,0,0,0,0,0,0,0
CONSIDERATION ON THE AUTOCLAVE-TYPE EQUIPMENT SIZING - PARTICULARIZATION FOR THE SUSPENSION SULFUR PRODUCTION PROCESSES,"DOBRE, T",,,,REVISTA DE CHIMIE,APR 1993,1993,44,4,,,,354,362,,,,,1,0.03,0,0,0,0,0,0,0,0,0,0,0,0,0,0,0,0,0,0,0,0,0,0,0,0,1,0,0,0,0,0,0,0,0,0,0,0,0,0,0,0,0,0,0,0,0,0,0,0,0
TECHNICAL SAFETY PHILOSOPHY IN SECURING THE ENVIRONMENT QUALITY,"PAVEL, A",,,,REVISTA DE CHIMIE,APR 1993,1993,44,4,,,,368,376,,,,,1,0.03,0,0,0,0,0,0,0,0,0,0,0,0,0,0,0,0,0,0,0,0,0,0,0,0,0,0,0,0,0,0,0,0,0,1,0,0,0,0,0,0,0,0,0,0,0,0,0,0,0
CHARACTERIZATION OF THE R-CELLULOSE TRIACETATE POWDER USED AS A STATIONARY PHASE IN THE THIN-LAYER CHROMATOGRAPHY,"MARUTOIU, C; CENAN, A; GRECU, R; MORARU, A",,,,REVISTA DE CHIMIE,FEB 1993,1993,44,2,,,,164,167,,,,,1,0.03,0,0,0,0,0,0,0,0,0,0,0,0,0,0,0,0,0,0,0,0,0,0,1,0,0,0,0,0,0,0,0,0,0,0,0,0,0,0,0,0,0,0,0,0,0,0,0,0,0
LIQUID-LIQUID-EXTRACTION PROCESS USING STATIC MIXERS,"VASILESCU, P; VALTER, RD",,,,REVISTA DE CHIMIE,FEB 1993,1993,44,2,,,,116,121,,,,,1,0.03,0,0,0,0,0,0,0,0,0,0,0,0,0,0,0,0,0,0,0,0,1,0,0,0,0,0,0,0,0,0,0,0,0,0,0,0,0,0,0,0,0,0,0,0,0,0,0,0,0
THE 2ND VIRIAL-COEFFICIENT OF CERTAIN ORGANIC MATTERS VAPORS,"BARHALA, A; MARCHIDAN, DI",,,,REVISTA DE CHIMIE,JAN 1993,1993,44,1,,,,34,38,,,,,1,0.03,0,0,0,0,0,0,0,0,0,0,0,0,0,0,0,0,0,0,0,0,0,0,0,0,0,0,0,0,0,0,0,0,0,0,0,0,0,0,0,0,0,0,0,0,0,0,1,0,0
CRITERIA FOR THE SOLIDS THERMAL-STABILITY,"FATU, D; SEGAL, E",,,,REVISTA DE CHIMIE,JAN 1993,1993,44,1,,,,44,49,,,,,1,0.03,0,0,0,0,0,0,0,0,0,0,0,0,0,0,0,0,0,0,0,0,0,0,0,0,0,0,0,0,0,0,0,0,0,0,0,0,0,0,0,1,0,0,0,0,0,0,0,0,0
ACETYLSALICYLIC-ACID NONISOTHERMAL THERMOKINETICS,"VILCU, R; MELTZER, V",,,,REVISTA DE CHIMIE,JAN 1993,1993,44,1,,,,23,25,,,,,1,0.03,0,0,0,0,0,0,0,0,0,0,0,0,0,0,0,0,0,0,0,0,0,0,0,0,0,1,0,0,0,0,0,0,0,0,0,0,0,0,0,0,0,0,0,0,0,0,0,0,0
ETHYL AMINOACETATE QUANTITATIVE-DETERMINATION IN SAMPLES CONTAINING AMINOACETIC ACID,"VLADESCU, L; BADEA, I; CAZACU, IC; PASARIN, S",,,,REVISTA DE CHIMIE,OCT 1992,1992,43,10,,,,654,657,,,,,1,0.03,0,0,0,0,0,0,0,0,0,0,0,0,0,0,0,0,0,0,0,1,0,0,0,0,0,0,0,0,0,0,0,0,0,0,0,0,0,0,0,0,0,0,0,0,0,0,0,0,0
DYNAMIC-SYSTEMS SENSITIVITY ANALYSIS .1. APPLICATIONS AND PROSPECTS,"UNGUREANU, S; CURTEANU, S",,,,REVISTA DE CHIMIE,SEP 1992,1992,43,9,,,,571,575,,,,,1,0.03,0,0,0,0,0,0,0,0,0,0,0,0,0,0,0,0,0,0,0,0,1,0,0,0,0,0,0,0,0,0,0,0,0,0,0,0,0,0,0,0,0,0,0,0,0,0,0,0,0
CORROSION INHIBITING EFFECTS OF THE PYRIDINE AND QUINOLINE QUATERNARY AMMONIUM DERIVATES,"CRETU, S; TOMESCU, M; KRAFT, E; IONESCU, M",,,,REVISTA DE CHIMIE,MAR-APR 1992,1992,43,3-4,,,,171,174,,,,,1,0.03,0,0,0,0,0,0,0,0,0,0,0,0,0,0,0,0,0,0,0,0,1,0,0,0,0,0,0,0,0,0,0,0,0,0,0,0,0,0,0,0,0,0,0,0,0,0,0,0,0
CARRIER ELECTROLYTE IMPORTANCE IN POLAROGRAPHIC DETERMINATIONS,"STEFAN, T; POPA, EO; BAIULESCU, GE",,,,REVISTA DE CHIMIE,MAR-APR 1992,1992,43,3-4,,,,155,157,,,,,1,0.03,0,0,0,0,0,0,0,0,0,0,0,0,0,0,0,0,0,1,0,0,0,0,0,0,0,0,0,0,0,0,0,0,0,0,0,0,0,0,0,0,0,0,0,0,0,0,0,0,0
ANTIENTROPIC EFFECTS OF THE CHEMICAL AND BIOCHEMICAL-ENGINEERING .2.,"COCIASU, CA; COROBEA, M",,,,REVISTA DE CHIMIE,JAN-FEB 1992,1992,43,1-2,,,,20,25,,,,,1,0.03,0,0,0,0,0,0,0,0,0,0,0,0,0,0,0,0,0,0,0,1,0,0,0,0,0,0,0,0,0,0,0,0,0,0,0,0,0,0,0,0,0,0,0,0,0,0,0,0,0
SEA-WATER CORROSION BEHAVIOR OF SOME PROTECTIVE COATINGS MADE OF NEW INDIGENOUS RUBBER TYPES,"VASILESCU, E; DROB, P; STRETCU, M",,,,REVISTA DE CHIMIE,JAN-FEB 1992,1992,43,1-2,,,,68,72,,,,,1,0.03,0,0,0,0,0,0,0,0,0,0,0,0,0,0,0,0,0,0,0,0,0,0,0,0,0,1,0,0,0,0,0,0,0,0,0,0,0,0,0,0,0,0,0,0,0,0,0,0,0
GRANULAR FERTILIZERS MECHANICAL STRENGTH .5. MICRONUTRIENTS EFFECT ON THE UREA GRANULES MECHANICAL STABILITY,"FILIPESCU, L; BECHERESCU, C; VASILESCU, G; POPESCU, M",,,,REVISTA DE CHIMIE,OCT-DEC 1991,1991,42,10-12,,,,524,526,,,,,1,0.03,0,0,0,0,0,0,0,0,0,0,0,0,0,0,0,0,0,0,0,0,0,0,0,0,0,0,0,0,0,0,0,0,0,0,1,0,0,0,0,0,0,0,0,0,0,0,0,0,0
KINETICS OF NITROGEN-OXIDES ADSORPTION IN UREA SOLUTIONS,"NAGY, I; IONITA, L; MUNTEAN, O",,,,REVISTA DE CHIMIE,OCT-DEC 1991,1991,42,10-12,,,,527,532,,,,,1,0.03,0,0,0,0,0,0,0,0,0,0,0,0,0,0,0,0,0,0,0,0,0,0,0,0,1,0,0,0,0,0,0,0,0,0,0,0,0,0,0,0,0,0,0,0,0,0,0,0,0
"DIPHAZE SYSTEM ULTRASONOLYSIS - CO CHLORIDE (II)-WATER-CARBON TETRACHLORIDE-2, 9 DIMETHYL, 10-PHENANTHROLYN","POPA, N; MARINESCU, D; KRIZA, A",,,,REVISTA DE CHIMIE,OCT-DEC 1991,1991,42,10-12,,,,514,516,,,,,1,0.03,0,0,0,0,0,0,0,0,0,0,0,0,0,0,0,0,0,0,0,0,0,0,0,0,1,0,0,0,0,0,0,0,0,0,0,0,0,0,0,0,0,0,0,0,0,0,0,0,0
REDUCTION OF THE IRON CONTENT IN THE BRINE EMPLOYED BY THE INDUSTRIAL ELECTROLYSIS PLANTS,"POPESCU, G; POPESCU, A; ENESCU, C; COSMA, A; ANTON, E",,,,REVISTA DE CHIMIE,OCT-DEC 1991,1991,42,10-12,,,,517,520,,,,,1,0.03,0,0,0,0,0,0,0,0,0,0,0,0,0,0,0,0,0,0,0,0,0,0,0,0,0,0,0,0,0,0,0,0,0,0,0,0,0,0,0,1,0,0,0,0,0,0,0,0,0
CORROSION-INHIBITORS USED TO PREVENT THE CORROSION EFFECTS IN LIQUID-NITROGEN FERTILIZERS,"CRETU, S; MICU, O; CONSTANTINESCU, M; OPRISAN, F",,,,REVISTA DE CHIMIE,AUG-SEP 1991,1991,42,8-9,,,,455,459,,,,,1,0.03,0,0,0,0,0,0,0,0,0,0,0,0,0,0,0,0,0,0,0,0,0,0,0,1,0,0,0,0,0,0,0,0,0,0,0,0,0,0,0,0,0,0,0,0,0,0,0,0,0
ADVANCED AUTOMATED-SYSTEM FOR THE CHEMIZATION PROPENE SEPARATION PROCESS .1. SYSTEM STRUCTURE,"MARINOIU, V; PARASCHIV, N",,,,REVISTA DE CHIMIE,AUG-SEP 1991,1991,42,8-9,,,,437,442,,,,,1,0.03,0,0,0,0,0,0,0,0,0,0,0,0,0,0,0,0,0,0,0,0,0,0,0,0,0,0,0,0,0,0,0,0,0,0,0,0,0,0,0,0,0,1,0,0,0,0,0,0,0
LIQUID-VAPOR-EQUILIBRIUM DATA IN BINARY-SYSTEMS OF CROTONALDEHYDE WITH ACETONE AND ACETIC-ACID,"SAVESCU, V; CIOROIANU, D; IONESCU, I; SIMOIU, L",,,,REVISTA DE CHIMIE,AUG-SEP 1991,1991,42,8-9,,,,402,405,,,,,1,0.03,0,0,0,0,0,0,0,0,0,0,0,0,0,0,0,0,0,0,0,0,0,1,0,0,0,0,0,0,0,0,0,0,0,0,0,0,0,0,0,0,0,0,0,0,0,0,0,0,0
METHOD OF INCREASING CALCIUM-CARBONATE SOLUBILITY IN AMMONIUM-S IT SOLUTIONS,"BELCU, M; PINCOVSCHI, E",,,,REVISTA DE CHIMIE,JUN-JUL 1991,1991,42,6-7,,,,304,307,,,,,1,0.03,0,0,0,0,0,0,0,0,0,0,0,0,0,0,0,0,0,1,0,0,0,0,0,0,0,0,0,0,0,0,0,0,0,0,0,0,0,0,0,0,0,0,0,0,0,0,0,0,0
MATHEMATICAL-MODELING OF CATALYTIC REACTORS WITH BEDS FOR AMMONIA-SYNTHESIS .2. BIDIMENSIONAL DISPERSION MODEL WITH 2 PARAMETERS,"GRIGORIU, I; BALASANIAN, I; SIMINICEANU, I",,,,REVISTA DE CHIMIE,JUN-JUL 1991,1991,42,6-7,,,,319,324,,,,,1,0.03,0,0,0,0,0,0,0,0,0,0,0,0,0,0,0,0,0,0,0,1,0,0,0,0,0,0,0,0,0,0,0,0,0,0,0,0,0,0,0,0,0,0,0,0,0,0,0,0,0
A NEW THERMAL TRANSFER MECHANISM FOR NUCLEATE BOILING,"SOARE, G",,,,REVISTA DE CHIMIE,JUN-JUL 1991,1991,42,6-7,,,,308,312,,,,,1,0.03,0,0,0,0,0,0,0,0,0,0,0,0,0,0,0,0,0,0,0,0,0,0,0,0,0,0,0,0,1,0,0,0,0,0,0,0,0,0,0,0,0,0,0,0,0,0,0,0,0
ENERGETIC ASPECTS REGARDING AMMONIA MANUFACTURING,"JIANU, D; BICA, M",,,,REVISTA DE CHIMIE,APR-MAY 1991,1991,42,4-5,,,,213,216,,,,,1,0.03,0,0,0,0,0,0,0,0,0,0,0,0,0,0,0,0,0,0,0,0,0,1,0,0,0,0,0,0,0,0,0,0,0,0,0,0,0,0,0,0,0,0,0,0,0,0,0,0,0
CALCULATION OF RECTANGULAR FLANGE ASSEMBLIES .1. CALCULATION METHOD,"JINESCU, VV; PAUNESCU, M; TACA, C; STEFANESCU, M",,,,REVISTA DE CHIMIE,APR-MAY 1991,1991,42,4-5,,,,241,247,,,,,1,0.03,0,0,0,0,0,0,0,0,0,0,0,0,0,0,0,0,1,0,0,0,0,0,0,0,0,0,0,0,0,0,0,0,0,0,0,0,0,0,0,0,0,0,0,0,0,0,0,0,0
ANALYSIS OF METHANE CRACKING REACTOR WITH WATER VAPORS,"SPOITU, C; NAGY, I; MUNTEAN, O",,,,REVISTA DE CHIMIE,APR-MAY 1991,1991,42,4-5,,,,217,225,,,,,1,0.03,0,0,0,0,0,0,0,0,0,0,0,0,0,0,0,0,0,0,0,0,0,0,0,0,0,0,0,0,0,1,0,0,0,0,0,0,0,0,0,0,0,0,0,0,0,0,0,0,0
MATHEMATICAL-MODELING OF CATALYTIC REACTORS WITH BEDS FOR AMMONIA-SYNTHESIS .1. MODEL OF TOTAL DISPLACEMENT REACTOR,"GRIGORIU, I; BALASANIAN, I; SIMINICEANU, I",,,,REVISTA DE CHIMIE,JAN-MAR 1991,1991,42,1-3,,,,83,86,,,,,1,0.03,0,0,0,0,0,0,0,0,0,0,0,0,0,0,0,0,0,0,0,1,0,0,0,0,0,0,0,0,0,0,0,0,0,0,0,0,0,0,0,0,0,0,0,0,0,0,0,0,0
CHRONOPOTENTIOMETRIC STUDY OF OXYGEN REDUCTION ON GOLD ELECTRODE,"PICA, EM; KEKEDY, L",,,,REVISTA DE CHIMIE,JAN-MAR 1991,1991,42,1-3,,,,97,101,,,,,1,0.03,0,0,0,0,0,0,0,0,0,0,0,0,0,0,0,0,1,0,0,0,0,0,0,0,0,0,0,0,0,0,0,0,0,0,0,0,0,0,0,0,0,0,0,0,0,0,0,0,0
APPLICATION OF ELECTRODE POTENTIAL MEASUREMENTS TO DEFINING TECHNOLOGICAL PARAMETERS OF CHEMICAL OXIDATION OF MAGNESIUM ALLOYS,"ROMAN, I; MATEI, V",,,,REVISTA DE CHIMIE,JAN-MAR 1991,1991,42,1-3,,,,106,110,,,,,1,0.03,0,0,0,0,0,0,0,0,0,0,0,0,0,0,0,0,0,0,0,0,0,0,1,0,0,0,0,0,0,0,0,0,0,0,0,0,0,0,0,0,0,0,0,0,0,0,0,0,0
ASPECTS OF ION FLOTATION AND ION MOLECULAR KINETICS .2. CU(II) FLOTATION WITH AMINE BASED COLLECTORS,"STOICA, L; MAGYAR, L",,,,REVISTA DE CHIMIE,JAN-MAR 1991,1991,42,1-3,,,,63,66,,,,,1,0.03,0,0,0,0,0,0,0,0,0,0,0,0,0,0,0,0,0,0,0,0,0,0,0,0,0,0,0,0,0,0,0,0,0,0,0,0,0,0,0,0,1,0,0,0,0,0,0,0,0
CHEMICAL-EQUILIBRIUM IN SULFUR-DIOXIDE REDUCTION PROCESSES .3. SULFUR-DIOXIDE REDUCTION WITH CARBON OXIDE - INFLUENCE OF INITIAL CONCENTRATION OF SULFUR-DIOXIDE,"PINCOVSCHI, E; SALCIANU, EI",,,,REVISTA DE CHIMIE,NOV-DEC 1990,1990,41,11-12,,,,889,892,,,,,1,0.03,0,0,0,0,0,0,0,0,0,0,0,0,0,0,0,0,0,0,0,1,0,0,0,0,0,0,0,0,0,0,0,0,0,0,0,0,0,0,0,0,0,0,0,0,0,0,0,0,0
ASPECTS REGARDING N-ALKANE SULFOXIDATION,"STANCIU, I; PAPAHAGI, L; AVRAM, R; CRISTESCU, C; DUTA, I; SAVU, D",,,,REVISTA DE CHIMIE,NOV-DEC 1990,1990,41,11-12,,,,885,888,,,,,1,0.03,0,0,0,0,0,0,0,0,0,0,0,0,0,0,0,0,0,0,0,0,0,0,0,0,0,0,0,0,0,0,0,0,0,0,1,0,0,0,0,0,0,0,0,0,0,0,0,0,0
DETERMINATION OF PALLADIUM FROM ALUMINUM-BASED CATALYSTS BY ATOMIC-ABSORPTION SPECTROMETRY,"NACU, A; BILBA, D; LEONTE, O",,,,REVISTA DE CHIMIE,OCT 1990,1990,41,10,,,,826,829,,,,,1,0.03,0,0,0,0,0,0,0,0,0,0,0,0,0,0,0,0,0,1,0,0,0,0,0,0,0,0,0,0,0,0,0,0,0,0,0,0,0,0,0,0,0,0,0,0,0,0,0,0,0
UP-TO-DATE PROBLEMS IN CRUDE MANUFACTURING .5. CATALYTIC PROCESSES IN RESIDUAL PETROLEUM-PRODUCTS .2.,"OLTEANU, B",,,,REVISTA DE CHIMIE,OCT 1990,1990,41,10,,,,775,&,,,,,1,0.03,0,0,0,0,0,0,0,0,0,0,0,0,0,0,0,0,0,1,0,0,0,0,0,0,0,0,0,0,0,0,0,0,0,0,0,0,0,0,0,0,0,0,0,0,0,0,0,0,0
"DETERMINATION OF OPTIMAL PARAMETERS OF P,P'-DINITRODIBENZYL REDUCTION TO P,P'-DIAMINODIBENZYL","ONICIU, L; OLEA, M; DANCIU, V",,,,REVISTA DE CHIMIE,OCT 1990,1990,41,10,,,,799,801,,,,,1,0.03,0,0,0,0,0,0,0,0,0,0,0,0,0,0,0,0,0,0,0,0,0,0,0,0,0,0,0,0,0,0,0,0,1,0,0,0,0,0,0,0,0,0,0,0,0,0,0,0,0
STUDY OF SURFACE OF PRETREATED SILVER ELECTRODE,"PICA, EM; KEKEDY, L",,,,REVISTA DE CHIMIE,OCT 1990,1990,41,10,,,,832,833,,,,,1,0.03,0,0,0,0,0,0,0,0,0,0,0,0,0,0,0,0,1,0,0,0,0,0,0,0,0,0,0,0,0,0,0,0,0,0,0,0,0,0,0,0,0,0,0,0,0,0,0,0,0
DYNAMIC SIMULATION OF LIQUID-LIQUID-EXTRACTION WITH NONMISCIBLE SOLVENTS,"WOINAROSCHY, A",,,,REVISTA DE CHIMIE,OCT 1990,1990,41,10,,,,821,825,,,,,1,0.03,0,0,0,0,0,0,0,0,0,0,0,0,0,0,0,0,0,0,0,0,0,0,0,1,0,0,0,0,0,0,0,0,0,0,0,0,0,0,0,0,0,0,0,0,0,0,0,0,0
"TRENDS IN CRUDE PROCESSING .2. REVAMPING OF PLANTS AND PROCESSES FOR GASOLINE, AROMATIC-HYDROCARBONS AND DISTILLATION PRODUCTS MANUFACTURING","OLTEANU, B",,,,REVISTA DE CHIMIE,MAY-JUN 1990,1990,41,5-6,,,,414,420,,,,,1,0.03,0,0,0,0,0,0,0,0,0,0,0,0,0,0,0,0,0,1,0,0,0,0,0,0,0,0,0,0,0,0,0,0,0,0,0,0,0,0,0,0,0,0,0,0,0,0,0,0,0
OBTAINING OF HETEROGENEOUS ANIONITIC MEMBRANES,"RADULESCU, G; SIPOS, A; SZABO, S; SIPOS, V; MOISE, MI; SZENTGYORGYI, P",,,,REVISTA DE CHIMIE,MAY-JUN 1990,1990,41,5-6,,,,511,512,,,,,1,0.03,0,0,0,0,0,0,0,0,0,0,0,0,0,0,0,0,0,0,0,0,0,0,0,0,0,0,1,0,0,0,0,0,0,0,0,0,0,0,0,0,0,0,0,0,0,0,0,0,0
BASIC LEA THIOACETATE - PB(SCN)2.3PB(OH)2 .1. KINETICS OF DEHYDRATION REACTION UNDER UNISOTHERMAL CONDITIONS,"TITA, D; SIMON, Z",,,,REVISTA DE CHIMIE,MAY-JUN 1990,1990,41,5-6,,,,443,447,,,,,1,0.03,0,0,0,0,0,0,0,0,0,0,0,0,0,0,0,1,0,0,0,0,0,0,0,0,0,0,0,0,0,0,0,0,0,0,0,0,0,0,0,0,0,0,0,0,0,0,0,0,0
LYOLUMINISCENCE OF DIPHENYLAMINE IRRADIATED WITH IONIZED RADIATIONS,"MIHALCEA, I; JIPA, S; CAZAC, C; ILIE, D; ILIE, S; SETNESCU, R; CONTINEANU, M",,,,REVISTA DE CHIMIE,APR 1990,1990,41,4,,,,366,369,,,,,1,0.03,0,0,0,0,0,0,0,0,0,0,0,0,0,0,0,0,0,0,0,0,0,0,0,0,0,0,0,0,1,0,0,0,0,0,0,0,0,0,0,0,0,0,0,0,0,0,0,0,0
"ELECTROCHEMICAL REACTOR FOR P,P'-DIAMINEBENZYL ELECTROSYNTHESIS","ONICIU, L; OLEA, M; SCHINTEIE, M",,,,REVISTA DE CHIMIE,APR 1990,1990,41,4,,,,345,347,,,,,1,0.03,0,0,0,0,0,0,0,0,0,0,0,0,0,0,0,0,0,0,0,0,0,0,0,0,0,0,0,0,0,0,0,0,1,0,0,0,0,0,0,0,0,0,0,0,0,0,0,0,0
BIS-ACETOACETARYLIDE DERIVED ORGANIC PIGMENTS,"SEBE, I; LEANCA, R",,,,REVISTA DE CHIMIE,APR 1990,1990,41,4,,,,309,311,,,,,1,0.03,0,0,0,0,0,0,0,0,0,0,0,0,0,0,0,0,0,0,0,0,0,0,0,0,0,0,0,0,0,0,0,0,0,0,0,0,0,1,0,0,0,0,0,0,0,0,0,0,0
LIQUID-VAPOR BALANCE IN UNARY SYSTEMS .1. EQUATION FOR VAPOR-PRESSURE CORRELATION,"DANCIU, T; DANCIU, E",,,,REVISTA DE CHIMIE,MAR 1990,1990,41,3,,,,257,264,,,,,1,0.03,0,0,0,0,0,0,0,0,0,0,0,0,0,0,0,0,0,0,0,0,0,0,0,0,0,0,0,0,0,0,0,0,0,0,1,0,0,0,0,0,0,0,0,0,0,0,0,0,0
