Title,Authors,Corporate Authors,Editors,Book Editors,Source Title,Publication Date,Publication Year,Volume,Issue,Part Number,Supplement,Special Issue,Beginning Page,Ending Page,Article Number,DOI,Conference Title,Conference Date,Total Citations,Average per Year,1975,1976,1977,1978,1979,1980,1981,1982,1983,1984,1985,1986,1987,1988,1989,1990,1991,1992,1993,1994,1995,1996,1997,1998,1999,2000,2001,2002,2003,2004,2005,2006,2007,2008,2009,2010,2011,2012,2013,2014,2015,2016,2017,2018,2019,2020,2021,2022,2023
NEW EQUATION OF STATE FOR FLUIDS .1. APPLICATION TO PVT CALCULI FOR PURE FLUIDS,"GEANA, D",,,,REVISTA DE CHIMIE,MAY 1986,1986,37,5,,,,303,309,,,,,46,1.21,0,0,0,0,0,0,0,0,0,0,0,0,1,0,1,2,0,2,0,2,1,2,1,1,0,1,0,0,2,0,0,0,1,3,1,3,2,1,3,3,2,5,0,2,1,1,1,1,0
NEW FLUID STATE EQUATION .2. APPLICATION TO THE PHASE-EQUILIBRIUM CALCULUS,"GEANA, D",,,,REVISTA DE CHIMIE,NOV 1986,1986,37,11,,,,951,959,,,,,39,1.03,0,0,0,0,0,0,0,0,0,0,0,0,1,0,1,2,0,1,0,2,0,2,1,1,0,1,0,0,1,0,0,0,0,3,1,2,2,1,2,3,1,5,0,2,1,1,1,1,0
PRINCIPLE OF CRITICAL ENERGY,"JINESCU, VV",,,,REVISTA DE CHIMIE,1984,1984,35,9,,,,858,861,,,,,19,0.48,0,0,0,0,0,0,0,0,0,0,0,0,0,0,2,0,0,0,0,0,1,1,2,0,1,0,0,0,0,0,0,0,1,0,0,0,0,0,3,0,3,1,3,1,0,0,0,0,0
Calixarenes - Conveyors in the liquid membranes. I. Calix [4] arenes derivated esters,"Serban, B; Ruse, E; Craciun, ME; Nechifor, G",,,,REVISTA DE CHIMIE,MAR 2000,2000,51,3,,,,190,197,,,,,17,0.71,0,0,0,0,0,0,0,0,0,0,0,0,0,0,0,0,0,0,0,0,0,0,0,0,0,1,0,1,0,0,0,3,0,0,1,1,1,1,2,3,1,0,0,1,1,0,0,0,0
"OPTIMUM SELECTIONS AND COMBINATION OF SOLVENT SYSTEMS IN THIN-LAYER CHROMATOGRAPHY, USING THE FUZZY SET-THEORY","SARBU, C; DUMITRESCU, D; POP, H",,,,REVISTA DE CHIMIE,MAY 1993,1993,44,5,,,,450,459,,,,,16,0.52,0,0,0,0,0,0,0,0,0,0,0,0,0,0,0,0,0,0,0,0,3,1,2,1,1,2,1,0,0,1,0,0,1,1,0,0,1,0,0,1,0,0,0,0,0,0,0,0,0
EVALUATION OF PARAMETERS FROM THE WILSON EQUATIONS BY THE METHOD OF THE MAXIMUM-LIKELIHOOD,"PANAITESCU, G",,,,REVISTA DE CHIMIE,1982,1982,33,12,,,,1110,1113,,,,,16,0.38,0,0,0,0,0,0,0,0,0,0,0,0,0,1,0,0,1,1,2,2,0,1,1,1,1,1,0,0,0,0,0,0,0,0,0,0,1,3,0,0,0,0,0,0,0,0,0,0,0
DEGRADATION OF PORPHYRIN PHOTOSENSITIZERS USED FOR THE CONVERSION OF SOLAR-ENERGY INTO CHEMICAL ENERGY,"ION, RM; TEODORESCU, L; MANDRAVEL, C; VOLANSKI, E; HILLEBRAND, M",,,,REVISTA DE CHIMIE,FEB 1990,1990,41,2,,,,129,133,,,,,15,0.44,0,0,0,0,0,0,0,0,0,0,0,0,0,0,0,0,0,0,1,1,0,0,1,1,1,1,0,0,0,0,0,0,1,0,0,2,2,1,1,0,0,0,0,0,0,1,1,0,0
The estimation of the antioxidant effect of plants extracts by chemiluminescence,"Meghea, A; Iftimie, N; Giurginca, M",,,,REVISTA DE CHIMIE,DEC 2004,2004,55,12,,,,1025,1028,,,,,14,0.7,0,0,0,0,0,0,0,0,0,0,0,0,0,0,0,0,0,0,0,0,0,0,0,0,0,0,0,0,0,0,3,4,1,0,1,0,0,0,1,0,0,1,1,0,0,0,0,2,0
Oscillating electrochemical phenomena around the equilibrium potential,"Semenescu, G",,,,REVISTA DE CHIMIE,MAR 1998,1998,49,3,,,,199,213,,,,,13,0.5,0,0,0,0,0,0,0,0,0,0,0,0,0,0,0,0,0,0,0,0,0,0,0,0,1,1,1,2,2,4,2,0,0,0,0,0,0,0,0,0,0,0,0,0,0,0,0,0,0
Nifedipine and chloramphenicol polarographic determination,"Dumitrescu, V; David, V; Pavel, A",,,,REVISTA DE CHIMIE,JUN 2001,2001,52,6,,,,317,320,,,,,12,0.52,0,0,0,0,0,0,0,0,0,0,0,0,0,0,0,0,0,0,0,0,0,0,0,0,0,0,0,0,2,1,3,0,0,0,0,1,0,1,0,2,1,1,0,0,0,0,0,0,0
NEW ASPECTS REGARDING THE MECHANISM OF PHOTODEGRADATION REACTION OF PORPHYRIN SENSITIZERS,"TEODORESCU, L; ION, RM",,,,REVISTA DE CHIMIE,APR 1990,1990,41,4,,,,312,315,,,,,12,0.35,0,0,0,0,0,0,0,0,0,0,0,0,0,0,0,0,0,0,3,1,0,0,0,0,0,2,0,0,0,0,0,1,1,0,0,2,0,0,0,0,0,0,0,0,0,1,1,0,0
Membrane materials. II. Electrodialysis with membranes of chemically modified polyetherketones,"Nechifor, AC; Ruse, E; Nechifor, G; Serban, B",,,,REVISTA DE CHIMIE,JUN 2002,2002,53,6,,,,472,482,,,,,11,0.5,0,0,0,0,0,0,0,0,0,0,0,0,0,0,0,0,0,0,0,0,0,0,0,0,0,0,0,0,1,0,1,1,1,0,1,1,1,1,1,0,0,1,0,0,0,0,0,1,0
ELECTROCHEMICAL SENSORS FOR THE POTENTIOMETRIC DETERMINATION OF COPPER AND NICKEL,"LUCA, C; PLENICEANU, M; MURESAN, N",,,,REVISTA DE CHIMIE,JAN-FEB 1992,1992,43,1-2,,,,64,67,,,,,11,0.34,0,0,0,0,0,0,0,0,0,0,0,0,0,0,0,0,0,0,0,1,3,1,1,0,0,0,0,2,0,0,2,0,0,0,1,0,0,0,0,0,0,0,0,0,0,0,0,0,0
SYNTHESIS OF 1-(2-PYRIMIDYL)-5-PYRAZOLONE DERIVATIVES,"CRISTEA, I; FARCASAN, V",,,,REVISTA DE CHIMIE,AUG 1987,1987,38,8,,,,674,679,,,,,11,0.3,0,0,0,0,0,0,0,0,0,0,0,0,0,0,1,0,0,1,0,1,0,1,1,1,1,0,1,0,0,1,0,0,1,0,1,0,0,0,0,0,0,0,0,0,0,0,0,0,0
SYNTHESIS OF SOME NITROGEN YPERITES WITH A CARRIER MADE OF ESTERS OF THE ASPARAGIC N-(PARA-AMINOBENZOYL)-L-ACID,"SUNEL, V; CIUGUREANU, C; BUDEANU, C",,,,REVISTA DE CHIMIE,OCT 1986,1986,37,10,,,,855,859,,,,,11,0.29,0,0,0,0,0,0,0,0,0,0,0,0,0,0,0,0,0,0,2,0,3,0,0,0,0,0,0,0,0,0,0,0,0,0,0,0,0,0,5,1,0,0,0,0,0,0,0,0,0
PREPARATION OF ANODES WITH ELECTROCATALYTICALLY ACTIVE FILMS OF METALLIC COMPLEXES USED IN WATER ELECTROLYSIS,"RADOI, I; BIRZESCU, M; GOLUMBIOSCHI, F; FERENCZ, A; STEFANESCU, M",,,,REVISTA DE CHIMIE,1985,1985,36,9,,,,832,835,,,,,11,0.28,0,0,0,0,0,0,0,0,0,0,0,0,0,0,0,0,0,0,0,0,0,0,1,0,0,0,2,0,0,0,0,0,0,1,2,0,0,0,2,2,0,0,0,1,0,0,0,0,0
The effect of the CO32- anion on the corrosion of carbon steel in an ammonium chloride solution,"Samide, A; Chirita, P; Rusu, O; Preda, M",,,,REVISTA DE CHIMIE,DEC 2004,2004,55,12,,,,1022,1024,,,,,10,0.5,0,0,0,0,0,0,0,0,0,0,0,0,0,0,0,0,0,0,0,0,0,0,0,0,0,0,0,0,0,0,0,1,0,0,0,0,0,0,1,7,1,0,0,0,0,0,0,0,0
Membrane materials. I. Polyetherketones,"Nechifor, AC; Ruse, E; Nechifor, G",,,,REVISTA DE CHIMIE,OCT 2001,2001,52,10,,,,531,540,,,,,10,0.43,0,0,0,0,0,0,0,0,0,0,0,0,0,0,0,0,0,0,0,0,0,0,0,0,0,0,0,0,1,0,0,2,1,0,1,1,1,1,0,0,0,1,0,0,0,0,0,1,0
PHENOLIC ANTIOXIDANTS EFFICIENCY IN LDPE - DETERMINATIONS BY THE OXYLUMINISCENCE METHOD,"JIPA, S; SETNESCU, T; SETNESCU, R; CAZAC, C; MIHALCEA, I",,,,REVISTA DE CHIMIE,JAN 1993,1993,44,1,,,,65,70,,,,,10,0.32,0,0,0,0,0,0,0,0,0,0,0,0,0,0,0,0,0,0,0,0,1,1,1,0,0,0,1,0,1,1,0,2,1,1,0,0,0,0,0,0,0,0,0,0,0,0,0,0,0
FLOW-INJECTION ANALYSIS .1. WORKING PRINCIPLE AND METHODS,"DANET, AF; LUCA, C",,,,REVISTA DE CHIMIE,MAY-JUN 1990,1990,41,5-6,,,,490,495,,,,,10,0.29,0,0,0,0,0,0,0,0,0,0,0,0,0,0,0,1,0,0,0,3,0,0,0,0,0,0,0,1,1,0,1,0,0,0,0,2,0,1,0,0,0,0,0,0,0,0,0,0,0
PORPHYRIN PHOTOSENSITIZERS APPLIED TO PHOTOOXIDATION REACTIONS,"TEODORESCU, L; ION, RM; MOCANU, E; CULETU, H; BADICA, D; BELSADSKI, M",,,,REVISTA DE CHIMIE,FEB 1988,1988,39,2,,,,132,137,,,,,10,0.28,0,0,0,0,0,0,0,0,0,0,0,0,0,0,0,0,0,0,1,0,0,0,0,3,0,0,0,0,0,1,0,1,0,0,0,1,0,0,0,0,0,1,0,0,0,2,0,0,0
ANALYSIS OF ETOXYLATED NONYLPHENOL BY MEANS OF NORMAL PHASE LIQUID-CHROMATOGRAPHY,"ANGHEL, DF; BALCAN, M; VOICU, A; ELIAN, M",,,,REVISTA DE CHIMIE,FEB 1987,1987,38,2,,,,148,151,,,,,10,0.27,0,0,0,0,0,0,0,0,0,0,0,0,0,0,0,0,1,0,0,1,0,1,0,0,0,0,1,1,1,0,1,1,0,0,0,0,1,0,0,1,0,0,0,0,0,0,0,0,0
ASPECTS REGARDING THE CHEMISTRY OF SOME COORDINATED OXIMES,"VOICULESCU, N; DOMINTE, L; SPIRATOS, M",,,,REVISTA DE CHIMIE,1983,1983,34,11,,,,973,980,,,,,10,0.24,0,0,0,0,0,0,0,0,0,0,0,0,0,1,0,1,0,0,0,0,0,2,1,1,1,0,1,1,1,0,0,0,0,0,0,0,0,0,0,0,0,0,0,0,0,0,0,0,0
"STRUCTURE AND REACTIVITY OF NITRILS - HEAT OF COMBUSTION AND OF FORMATION OF SOME ALPHA-UNSATURATED, BETA-UNSATURATED NITRILS DERIVED FROM BENZYLIDEN-PARA-NITROPHENYLACETONITRIL","ZAVOIANU, D; PERISANU, S; MOGAGHEORGHE, S; BORNAZ, C",,,,REVISTA DE CHIMIE,1983,1983,34,11,,,,987,988,,,,,10,0.24,0,0,0,0,0,0,0,0,0,0,1,0,0,0,0,0,0,0,1,1,0,0,1,0,2,2,1,0,0,0,0,0,0,0,0,0,0,0,1,0,0,0,0,0,0,0,0,0,0
CATALYSIS BY POLYMERS .3. SYNTHESIS OF 3-CHLORO-2-HYDROXYPROPYL ACRYLATE ON ION-EXCHANGE RESINS,"DUMITRIU, E; OPREA, S; DIMA, M; AVRAMESCU, S",,,,REVISTA DE CHIMIE,1981,1981,32,3,,,,225,229,,,,,10,0.23,0,0,0,0,0,0,0,0,1,0,2,0,0,0,0,1,0,0,0,0,0,0,0,0,1,0,0,0,0,0,1,0,2,1,1,0,0,0,0,0,0,0,0,0,0,0,0,0,0
The obtaining and characterisation of NaCl nanocrystalline dispersions for saline type therapeutical climate. III. The evaluation of the Saline device reliability,"Sandu, I; Pascu, C; Sandu, IG; Ciobanu, G; Sandu, AV; Ciobanus, O",,,,REVISTA DE CHIMIE,DEC 2004,2004,55,12,,,,975,982,,,,,9,0.45,0,0,0,0,0,0,0,0,0,0,0,0,0,0,0,0,0,0,0,0,0,0,0,0,0,0,0,0,0,0,0,1,0,0,1,3,0,0,1,0,2,0,0,1,0,0,0,0,0
CHEMICALLY-MODIFIED R-SILICA-GEL PREPARATION AND CHARACTERIZATION .1. N-OCTENE R-SILICA-GEL,"COMAN, V; MARUTOIU, C; MARCU, G; GRECU, R",,,,REVISTA DE CHIMIE,SEP 1994,1994,45,9,,,,781,785,,,,,9,0.3,0,0,0,0,0,0,0,0,0,0,0,0,0,0,0,0,0,0,0,0,1,1,2,0,0,1,0,0,2,0,0,0,0,0,1,0,0,1,0,0,0,0,0,0,0,0,0,0,0
STRUCTURE AND REACTIVITY OF ACIDS - COMBUSTION AND FORMATION HEAT OF SOME PHENYLACRYLIC ACIDS,"ZAVOIANU, D; CIOCAZANU, I; MOGAGHEORGHE, S; BORNAZ, C",,,,REVISTA DE CHIMIE,MAR 1990,1990,41,3,,,,234,236,,,,,9,0.26,0,0,0,0,0,0,0,0,0,0,0,0,0,0,0,0,0,0,1,1,0,0,1,0,1,2,1,1,0,0,0,0,0,0,0,0,0,0,0,1,0,0,0,0,0,0,0,0,0
METHANOL ADDITION TO ISOANYLENE ON MACROPOROUS CATIONITES,"MUJA, I; GOIDEA, D; MARCULESCU, N; ANDREESCU, G; CURCA, CI; ANTONESCU, I",,,,REVISTA DE CHIMIE,DEC 1986,1986,37,12,,,,1047,1054,,,,,9,0.24,0,0,0,0,0,0,0,0,0,0,0,0,0,0,0,0,0,0,0,1,2,1,1,1,0,0,0,1,1,1,0,0,0,0,0,0,0,0,0,0,0,0,0,0,0,0,0,0,0
DETERMINATION OF IONIC SURFACTANTS IN SHAMPOOS USING A DODECYL-SULFATE LIQUID MEMBRANE SELECTIVE ELECTRODE,"ANGHEL, DF; POPESCU, G; LOWY, D",,,,REVISTA DE CHIMIE,1983,1983,34,12,,,,1106,1110,,,,,9,0.22,0,0,0,0,0,0,0,0,0,0,1,2,1,0,0,0,2,0,2,0,0,1,0,0,0,0,0,0,0,0,0,0,0,0,0,0,0,0,0,0,0,0,0,0,0,0,0,0,0
The evolution of the heavy metals concentration in the Danube riverbed sediments from the Bazias - Penile de Fier I ecosystem (1996-1999),"Matache, M; Patroescu, C; Patroescu-Klotz, I",,,,REVISTA DE CHIMIE,SEP 2002,2002,53,9,,,,623,626,,,,,8,0.36,0,0,0,0,0,0,0,0,0,0,0,0,0,0,0,0,0,0,0,0,0,0,0,0,0,0,0,0,0,0,0,0,0,0,1,2,0,2,2,0,0,0,0,1,0,0,0,0,0
"Complex combinations with 1-H-indole-2,3-dione. 1. Sn(IV) and Zr(IV) complex combinations with 1-H-indole-2,3 dione","Kriza, A; Parnau, C; Popa, N",,,,REVISTA DE CHIMIE,JUN 2001,2001,52,6,,,,346,348,,,,,8,0.35,0,0,0,0,0,0,0,0,0,0,0,0,0,0,0,0,0,0,0,0,0,0,0,0,0,0,0,0,0,0,0,0,0,1,1,4,2,0,0,0,0,0,0,0,0,0,0,0,0
Liquid chromatography analysis of the phenol and Ce(SO4)(2) mediated electrooxidation products,"Goncea, CM; Oniciu, L; Marutoiu, C; Filip, M",,,,REVISTA DE CHIMIE,MAR 1999,1999,50,3,,,,216,220,,,,,8,0.32,0,0,0,0,0,0,0,0,0,0,0,0,0,0,0,0,0,0,0,0,0,0,0,0,0,1,2,1,2,1,1,0,0,0,0,0,0,0,0,0,0,0,0,0,0,0,0,0,0
Porphyrin purity spectral analysis,"Ion, RM; Mandravel, C; Bercu, C",,,,REVISTA DE CHIMIE,FEB 1998,1998,49,2,,,,121,127,,,,,8,0.31,0,0,0,0,0,0,0,0,0,0,0,0,0,0,0,0,0,0,0,0,0,0,0,0,0,0,2,1,0,2,0,0,2,0,0,0,1,0,0,0,0,0,0,0,0,0,0,0,0
"STRUCTURE AND REACTIVITY OF NITRILES - COMBUSTION AND FORMATION HEAT OF SOME ALPHA,BETA-UNSATURATED NITRILES OBTAINED FROM BENZILIDENE-TETRAHYDRONAPHTHYL ACETONITRILE","ZAVOIANU, D; CIOCAZANU, I; MOGAGHEORGHE, S; BORNAZ, C",,,,REVISTA DE CHIMIE,NOV 1986,1986,37,11,,,,960,962,,,,,8,0.21,0,0,0,0,0,0,0,0,0,0,0,0,0,0,0,0,0,0,1,1,0,0,1,0,2,2,1,0,0,0,0,0,0,0,0,0,0,0,0,0,0,0,0,0,0,0,0,0,0
"SYNTHESIS OF SOME PYRROLO[1,2-C]PYRIMIDINE DERIVATIVES","GEORGESCU, FC; GEORGESCU, EI; CHIRALEU, F; GEORGESCU, EG",,,,REVISTA DE CHIMIE,1983,1983,34,12,,,,1130,1131,,,,,8,0.2,0,0,0,0,0,0,0,0,0,0,0,1,0,0,0,0,0,0,0,0,0,0,2,0,0,0,3,1,0,0,0,0,1,0,0,0,0,0,0,0,0,0,0,0,0,0,0,0,0
METHOD AND SUM-ELECTRODE FOR DETERMINING THE TOTAL CONCENTRATION OF FREE IONS IN SOLUTIONS .1.,"BONCIOCAT, N; BORDA, M; BORCA, S; IVANOV, L",,,,REVISTA DE CHIMIE,1982,1982,33,4,,,,367,370,,,,,8,0.19,0,0,0,0,0,0,0,0,0,1,1,0,0,0,0,0,1,1,1,0,1,0,0,1,0,1,0,0,0,0,0,0,0,0,0,0,0,0,0,0,0,0,0,0,0,0,0,0,0
ANODIC-OXIDATION OF PARA-CHLORINE-ANILINE ON PLATINUM-ELECTRODES,"BRANZOI, V; STERNBERG, S; BADEA, T; NICOLA, M",,,,REVISTA DE CHIMIE,1982,1982,33,4,,,,333,336,,,,,8,0.19,0,0,0,0,0,0,0,0,0,0,1,1,0,0,0,0,0,0,0,0,2,0,0,0,0,0,2,0,1,0,0,1,0,0,0,0,0,0,0,0,0,0,0,0,0,0,0,0,0
New N-substituted pyrazolyl-benzenesulfonamide compounds as analogues of COX-2 selective inhibitors,"Croitoru, M; Pintilie, L; Tanase, C; Stuparu, A; Cioates, C; Cocu, F; Caproiu, MT; Draghici, C",,,,REVISTA DE CHIMIE,DEC 2004,2004,55,12,,,,993,997,,,,,7,0.35,0,0,0,0,0,0,0,0,0,0,0,0,0,0,0,0,0,0,0,0,0,0,0,0,0,0,0,0,0,0,1,1,0,0,0,0,0,4,1,0,0,0,0,0,0,0,0,0,0
Applications of the natural zeolites in the metals elimination from waste waters and in the catalyzing of some chemical reactions. II. The inferior aldehydes condensation catalyzed by natural clinoptilolite modified by metalic cations ionic exchange,"Dumitriu, E; Hulea, V; Cobzaru, C; Oprea, S",,,,REVISTA DE CHIMIE,FEB 2003,2003,54,2,,,,142,145,,,,,7,0.33,0,0,0,0,0,0,0,0,0,0,0,0,0,0,0,0,0,0,0,0,0,0,0,0,0,0,0,0,0,0,0,0,0,0,1,1,1,2,0,0,1,0,0,1,0,0,0,0,0
"Synthesis of new esters, derived from cholesterol","Baciu, I; Cirlanaru, C; Draghici, C; Caproiu, MT",,,,REVISTA DE CHIMIE,MAY 2000,2000,51,5,,,,392,395,,,,,7,0.29,0,0,0,0,0,0,0,0,0,0,0,0,0,0,0,0,0,0,0,0,0,0,0,0,0,1,0,3,0,1,1,0,0,0,1,0,0,0,0,0,0,0,0,0,0,0,0,0,0
Critical polymer concentration in highly diluted solutions,"Cincu, C; Butac, LM; Iliescu, M",,,,EUROPEAN POLYMER JOURNAL,MAR 2000,2000,36,3,,,,473,477,,10.1016/S0014-3057(99)00102-0,,,7,0.29,0,0,0,0,0,0,0,0,0,0,0,0,0,0,0,0,0,0,0,0,0,0,0,0,0,1,0,0,1,0,1,0,0,1,1,0,1,0,0,0,0,1,0,0,0,0,0,0,0
Study of inert SnO2-anodes in cryolite-alumina melts,"Zuca, S; Popescu, AM; Ene, N; Constantin, V",,,,REVISTA DE CHIMIE,JAN 1999,1999,50,1,,,,42,47,,,,,7,0.28,0,0,0,0,0,0,0,0,0,0,0,0,0,0,0,0,0,0,0,0,0,0,0,0,0,0,0,2,0,0,0,0,1,0,0,1,1,0,0,1,1,0,0,0,0,0,0,0,0
Fuzzy regression. II. Outliers cases,"Pop, HF; Sarbu, C",,,,REVISTA DE CHIMIE,OCT 1997,1997,48,10-11,,,,888,891,,,,,7,0.26,0,0,0,0,0,0,0,0,0,0,0,0,0,0,0,0,0,0,0,0,0,0,0,0,0,2,2,1,0,1,1,0,0,0,0,0,0,0,0,0,0,0,0,0,0,0,0,0,0
Pinacol synthesis by acetone reduction coupling,"Totir, ND; Velea, S; Lete, C; Neamtu, C",,,,REVISTA DE CHIMIE,JUN 1997,1997,48,6,,,,489,493,,,,,7,0.26,0,0,0,0,0,0,0,0,0,0,0,0,0,0,0,0,0,0,0,0,0,0,0,0,0,0,0,0,0,1,0,1,1,1,0,0,0,2,0,0,0,0,1,0,0,0,0,0,0
High density polyethylene modification with styrene-butadiene block copolymers .1. The effect of the styrene content in the star block copolymers,"Ghioca, P; Buzdugan, E; Stribeck, N; Serban, S; Cerchez, I; Stancu, R; Iovu, M; Stinga, F",,,,MATERIALE PLASTICE,1996,1996,33,4,,,,246,252,,,,,7,0.25,0,0,0,0,0,0,0,0,0,0,0,0,0,0,0,0,0,0,0,0,0,0,2,0,2,0,2,0,0,0,1,0,0,0,0,0,0,0,0,0,0,0,0,0,0,0,0,0,0
"Polyamide-based compositions used for injection- or extrusion-processing .3. Fireproofed polyamides. Possibilities of producing them, characteristics and applications","Petrovan, S; Murariu, M; Chiuaru, E; Lungu, G; Ibanescu, C",,,,MATERIALE PLASTICE,1996,1996,33,3,,,,188,195,,,,,7,0.25,0,0,0,0,0,0,0,0,0,0,0,0,0,0,0,0,0,0,0,0,0,0,0,0,1,2,2,2,0,0,0,0,0,0,0,0,0,0,0,0,0,0,0,0,0,0,0,0,0
SPECTROMETRIC STUDY OF THE TETRAARYLPORPHYRINS - MESO-SUBSTITUTE EFFECT,"ION, RM",,,,REVISTA DE CHIMIE,MAY 1993,1993,44,5,,,,431,434,,,,,7,0.23,0,0,0,0,0,0,0,0,0,0,0,0,0,0,0,0,0,0,0,1,0,0,0,1,1,0,0,0,0,0,0,0,1,0,0,1,2,0,0,0,0,0,0,0,0,0,0,0,0
FILTRATION - PHYSICAL MODELS AND OPERATING-CONDITIONS,"FLOAREA, O; MIHAI, M; MORARU, M; KOHN, D; SORA, M",,,,REVISTA DE CHIMIE,OCT-DEC 1991,1991,42,10-12,,,,553,557,,,,,7,0.21,0,0,0,0,0,0,0,0,0,0,0,0,0,0,0,0,0,0,0,0,0,0,0,0,0,0,0,1,0,1,0,0,0,1,1,0,2,0,0,0,0,0,0,0,0,1,0,0,0
GUAIACOL FORMYLATION,"MAIOR, O; NICOLAE, A",,,,REVISTA DE CHIMIE,FEB 1990,1990,41,2,,,,119,124,,,,,7,0.21,0,0,0,0,0,0,0,0,0,0,0,0,0,0,0,0,0,1,1,1,0,0,2,0,0,0,0,0,1,0,0,0,1,0,0,0,0,0,0,0,0,0,0,0,0,0,0,0,0
CRITICAL ENERGY PRINCIPLE .3. APPLICATIONS TO ISOTHERMAL VARIABLE STRESSES,"JINESCU, VV",,,,REVISTA DE CHIMIE,JUL 1989,1989,40,7,,,,622,627,,,,,7,0.2,0,0,0,0,0,0,0,0,0,0,0,0,0,0,0,0,1,0,0,1,1,0,2,0,0,0,0,0,0,0,0,0,0,0,0,0,0,0,1,0,1,0,0,0,0,0,0,0,0
EXPERIMENTAL PHARMACODYNAMIC STUDY OF SOME NEW AMINOACETARYLIDES AND PHENOXYACETARYLIDES,"IOVU, M; MURGU, L; BURA, C; GHEORGHISOR, M",,,,REVISTA DE CHIMIE,1982,1982,33,7,,,,601,604,,,,,7,0.17,0,0,0,0,0,0,0,0,0,0,0,0,0,1,0,0,0,0,0,1,0,0,0,0,0,1,0,0,1,0,0,0,1,1,1,0,0,0,0,0,0,0,0,0,0,0,0,0,0
SELECTIVE NITRATION OF PHENOTHIAZINE,"RAILEANU, M",,,,REVISTA DE CHIMIE,1982,1982,33,12,,,,1102,1105,,,,,7,0.17,0,0,0,0,0,0,0,0,1,3,2,0,1,0,0,0,0,0,0,0,0,0,0,0,0,0,0,0,0,0,0,0,0,0,0,0,0,0,0,0,0,0,0,0,0,0,0,0,0
WATER-TREATMENT PROCESS WITH AMMONIUM-IONS AND AMMONIA RECOVERY,"CALU, N; RANG, A; CECAL, A; BERDAN, I; SANDU, I",,,,REVISTA DE CHIMIE,1981,1981,32,9,,,,896,901,,,,,7,0.16,0,0,0,0,0,0,0,0,0,0,0,0,0,0,0,0,0,0,0,0,0,0,0,0,0,0,0,0,0,0,0,0,0,0,0,1,2,2,1,0,0,0,0,1,0,0,0,0,0
MALEINIMIDE COMPOUNDS .1. N-SUBSTITUTED MALEINIMIDES - SYNTHESIS AND PROPERTIES,"GHERASIM, GM; ZUGRAVESCU, I",,,,REVISTA DE CHIMIE,1981,1981,32,11,,,,1047,1054,,,,,7,0.16,0,0,0,0,0,0,0,0,0,0,1,0,0,0,0,0,0,1,0,1,0,0,1,0,0,0,1,0,2,0,0,0,0,0,0,0,0,0,0,0,0,0,0,0,0,0,0,0,0
Study of the sensitivised photodegradation of cholesterol in the presence of Cu(II) and Zn(II) complexes with macrocyclic tetrapyrolic ligands,"Boscencu, R; Nacea, V; Licsandru, D; Negoiu, D",,,,REVISTA DE CHIMIE,SEP 2002,2002,53,9,,,,619,622,,,,,6,0.27,0,0,0,0,0,0,0,0,0,0,0,0,0,0,0,0,0,0,0,0,0,0,0,0,0,0,0,0,1,2,0,0,1,2,0,0,0,0,0,0,0,0,0,0,0,0,0,0,0
Influence of water on the behaviour of low-alloy steels in ethylene glycol and succinic acid organic media,"Sutimanu, D; Craus, ML; Rusu, I; Cailean, A; Cretescu, I; Vizitiu, M; Macoviciuc, M",,,,REVISTA DE CHIMIE,JAN 1999,1999,50,1,,,,33,37,,,,,6,0.24,0,0,0,0,0,0,0,0,0,0,0,0,0,0,0,0,0,0,0,0,0,0,0,0,1,2,0,2,0,1,0,0,0,0,0,0,0,0,0,0,0,0,0,0,0,0,0,0,0
New shape indices for the molecules,"Tarko, L; Calafeteanu, S",,,,REVISTA DE CHIMIE,MAR 1998,1998,49,3,,,,169,173,,,,,6,0.23,0,0,0,0,0,0,0,0,0,0,0,0,0,0,0,0,0,0,0,0,0,0,0,0,0,0,1,0,0,1,1,0,1,0,0,0,1,0,0,0,1,0,0,0,0,0,0,0,0
"A lipophilicity study for the ethanol-amine-amidoesters, by reverse phase thin layer chromatography","Todor, S; Sarbu, C",,,,REVISTA DE CHIMIE,MAR 1998,1998,49,3,,,,177,182,,,,,6,0.23,0,0,0,0,0,0,0,0,0,0,0,0,0,0,0,0,0,0,0,0,0,0,0,0,2,2,1,1,0,0,0,0,0,0,0,0,0,0,0,0,0,0,0,0,0,0,0,0,0
ELECTROCHEMICAL SENSORS FOR CU(II) AND NI(II) POTENTIOMETRIC DETERMINATIONS,"PLENICEANU, M; POPESCU, A; PREDA, M; BANICERU, M",,,,REVISTA DE CHIMIE,OCT 1995,1995,46,10,,,,929,932,,,,,6,0.21,0,0,0,0,0,0,0,0,0,0,0,0,0,0,0,0,0,0,0,0,0,1,1,0,0,0,0,1,0,0,2,0,0,0,1,0,0,0,0,0,0,0,0,0,0,0,0,0,0
POWER REQUIRED FOR MIXING NON-NEWTONIAN FLUIDS IN SPHERICAL RECEIVERS,"TACA, CC; JINESCU, CV; MUNTEAN, O",,,,REVISTA DE CHIMIE,AUG 1994,1994,45,8,,,,720,723,,,,,6,0.2,0,0,0,0,0,0,0,0,0,0,0,0,0,0,0,0,0,0,0,0,1,0,4,0,0,0,0,0,0,0,0,0,0,0,0,0,0,0,0,0,1,0,0,0,0,0,0,0,0
"CHARACTERIZATION OF SILICA-GEL CHEMICALLY BONDED BASED ON R-NH2, USED FOR THIN-LAYER CHROMATOGRAPHY","MARUTOIU, C; CONSTANTINESCU, R; DOGAR, F",,,,REVISTA DE CHIMIE,JUL 1994,1994,45,7,,,,600,603,,,,,6,0.2,0,0,0,0,0,0,0,0,0,0,0,0,0,0,0,0,0,0,0,0,0,0,0,1,1,1,0,0,1,0,0,0,0,0,0,0,0,1,0,1,0,0,0,0,0,0,0,0,0
NEW LIQUID-MEMBRANE ELECTRODES FOR COPPER POTENTIOMETRIC DOSAGE,"PLENICEANU, M",,,,REVISTA DE CHIMIE,JUL 1994,1994,45,7,,,,596,599,,,,,6,0.2,0,0,0,0,0,0,0,0,0,0,0,0,0,0,0,0,0,0,0,0,1,1,1,0,0,0,0,0,0,0,2,0,0,0,1,0,0,0,0,0,0,0,0,0,0,0,0,0,0
SYNTHESIS OF THE TRIPHENYLPHOSPHONIUM SALT GRAFTED ON GEL-TYPE STYRENE-DIVINYLBENZENE COPOLYMERS,"VALCEANU, R; DAVIDESCU, CM; POPA, A",,,,REVISTA DE CHIMIE,JUL 1994,1994,45,7,,,,560,566,,,,,6,0.2,0,0,0,0,0,0,0,0,0,0,0,0,0,0,0,0,0,0,0,0,1,0,1,0,0,0,1,1,2,0,0,0,0,0,0,0,0,0,0,0,0,0,0,0,0,0,0,0,0
APPLICATION OF SPHERICAL RECEIVERS PROVIDED WITH MIXING DEVICES IN THE PROCESS PLANTS,"TACA, CC; JINESCU, CV",,,,REVISTA DE CHIMIE,APR 1993,1993,44,4,,,,363,367,,,,,6,0.19,0,0,0,0,0,0,0,0,0,0,0,0,0,0,0,0,0,0,0,1,0,0,3,0,1,0,0,0,0,0,0,0,0,0,0,0,0,0,0,0,1,0,0,0,0,0,0,0,0
TIB2 ELECTROSYNTHESIS IN MELTED ELECTROLYTES,"POPESCU, AM; OLTEANU, M; ZUCA, S",,,,REVISTA DE CHIMIE,JAN 1993,1993,44,1,,,,39,43,,,,,6,0.19,0,0,0,0,0,0,0,0,0,0,0,0,0,0,0,0,0,0,0,0,0,0,0,0,2,1,1,0,0,0,0,0,0,0,0,0,0,0,0,0,0,1,0,0,1,0,0,0,0
CRITICAL ENERGY PRINCIPLE IN THE DOMAIN OF MATERIAL BREAKING MECHANISM .2.,"JINESCU, VV",,,,REVISTA DE CHIMIE,APR 1990,1990,41,4,,,,305,308,,,,,6,0.18,0,0,0,0,0,0,0,0,0,0,0,0,0,0,0,0,0,0,0,0,0,0,1,0,0,0,0,0,0,0,0,0,0,0,0,0,0,1,1,0,1,0,2,0,0,0,0,0,0
MECHANISM OF ORGANOHALOGENSILANES OBTAINING BY DIRECT SYNTHESIS .1. ACTIVE STATE OF THE CATALYST,"VOICULESCU, N",,,,REVISTA DE CHIMIE,DEC 1989,1989,40,12,,,,962,965,,,,,6,0.17,0,0,0,0,0,0,0,0,0,0,0,0,0,0,0,0,0,0,0,0,0,0,0,0,0,0,0,4,1,1,0,0,0,0,0,0,0,0,0,0,0,0,0,0,0,0,0,0,0
OPTIMIZATION OF THE OXYGEN MASS-TRANSFER CONDITIONS IN A BIOREACTOR,"GAVRILESCU, M; ROMAN, R; SAUCIUC, A; PINTILIE, A; PASCAL, A; MACOVEANU, M",,,,REVISTA DE CHIMIE,NOV 1989,1989,40,11,,,,921,922,,,,,6,0.17,0,0,0,0,0,0,0,0,0,0,0,0,0,0,0,0,0,0,0,1,0,5,0,0,0,0,0,0,0,0,0,0,0,0,0,0,0,0,0,0,0,0,0,0,0,0,0,0,0
PRINCIPLE OF CRITICAL ENERGY .2. APPLICATIONS TO ISOTHERMAL VARIABLE DUTY,"JINESCU, VV",,,,REVISTA DE CHIMIE,JAN 1989,1989,40,1,,,,67,72,,,,,6,0.17,0,0,0,0,0,0,0,0,0,0,0,0,0,0,0,0,1,0,0,0,1,0,1,0,0,0,0,0,0,0,0,0,0,0,0,0,0,0,1,0,1,0,1,0,0,0,0,0,0
STUDY OF THE THERMAL OXIDATING STABILIZATION OF THE LOW-DENSITY POLYETHYLENE WITH DIFFERENT ANTIOXIDANTS,"ANDREI, C; IONA, P",,,,REVISTA DE CHIMIE,DEC 1988,1988,39,12,,,,1068,1072,,,,,6,0.17,0,0,0,0,0,0,0,0,0,0,0,0,0,0,0,0,0,0,2,0,0,2,0,0,0,0,1,0,0,1,0,0,0,0,0,0,0,0,0,0,0,0,0,0,0,0,0,0,0
USE OF COMPUTER IN STRUCTURAL-ANALYSIS .2. STRUCTURE OF PENTAHYDRATE NICKEL CYANIDE,"PALADE, T; NUTIU, M",,,,REVISTA DE CHIMIE,JAN 1986,1986,37,1,,,,80,81,,,,,6,0.16,0,0,0,0,0,0,0,0,0,0,0,0,0,0,0,0,0,0,0,0,0,0,1,0,0,0,0,0,1,0,0,0,0,2,0,0,0,1,0,0,0,0,1,0,0,0,0,0,0
"1,3,5-TRIARYL-PYRAZOLINE OPTICAL BLEACHING AGENTS","PREJMEREANU, I; CIMPEANU, I",,,,REVISTA DE CHIMIE,1985,1985,36,10,,,,894,898,,,,,6,0.15,0,0,0,0,0,0,0,0,0,0,0,0,0,0,1,0,1,0,0,2,1,0,0,1,0,0,0,0,0,0,0,0,0,0,0,0,0,0,0,0,0,0,0,0,0,0,0,0,0
ANALYTICAL APPLICATIONS OF THE LIQUID MEMBRANE - ELECTRODE NITRATE-SELECTIVE,"HOPIRTEAN, E; STEFANIGA, E",,,,REVISTA DE CHIMIE,1984,1984,35,10,,,,945,947,,,,,6,0.15,0,0,0,0,0,0,0,0,0,0,0,2,1,0,0,0,0,0,1,0,0,0,0,0,0,1,1,0,0,0,0,0,0,0,0,0,0,0,0,0,0,0,0,0,0,0,0,0,0
STUDY OF SOME POLYCRYSTALLINE SELENITES RADIOLYSIS BY DIFFUSE REFLECTION SPECTROSCOPY,"CONTINEANU, M",,,,REVISTA DE CHIMIE,1983,1983,34,7,,,,610,612,,,,,6,0.15,0,0,0,0,0,0,0,0,0,0,0,0,0,0,0,0,1,0,0,0,0,0,0,2,3,0,0,0,0,0,0,0,0,0,0,0,0,0,0,0,0,0,0,0,0,0,0,0,0
ETHYLENE DIMERIZATION BY HETEROGENEOUS COORDINATED CATALYSIS .3.,"ANGELESCU, E; ANGELESCU, A; NENCIULESCU, S; NICOLESCU, IV",,,,REVISTA DE CHIMIE,1981,1981,32,6,,,,559,563,,,,,6,0.14,0,0,0,0,0,0,0,0,1,0,0,1,1,0,0,2,0,0,0,0,0,0,0,0,0,0,0,0,0,1,0,0,0,0,0,0,0,0,0,0,0,0,0,0,0,0,0,0,0
ANALYTICAL CHARACTERIZATION AND EVALUATION OF A CU-2+-SELECTIVE MEMBRANE-ELECTRODE,"NEGOIU, D; IONESCU, MS; CRISTESCU, C",,,,REVISTA DE CHIMIE,1981,1981,32,1,,,,67,70,,,,,6,0.14,0,0,0,0,0,0,0,1,1,1,0,0,0,0,0,0,0,2,0,1,0,0,0,0,0,0,0,0,0,0,0,0,0,0,0,0,0,0,0,0,0,0,0,0,0,0,0,0,0
DETERMINATION AND INTERPRETATION OF ACTIVITY-COEFFICIENTS AT INFINITE DILUTION OF SOME HYDROCARBONS IN TERMINAL DIHYDROXY ALCOHOLS,"OPRIS, I",,,,REVISTA DE CHIMIE,1981,1981,32,3,,,,234,238,,,,,6,0.14,0,0,0,0,0,0,0,0,1,1,0,0,0,0,0,0,0,0,0,0,0,0,0,0,0,0,1,0,0,0,0,0,0,0,0,0,0,0,0,0,0,0,2,1,0,0,0,0,0
CO2-LASER GAIN,"DUMITRAS, DC",,,,STUDII SI CERCETARI DE FIZICA,1977,1977,29,2,,,,133,157,,,,,6,0.13,0,0,0,1,1,0,1,0,0,0,3,0,0,0,0,0,0,0,0,0,0,0,0,0,0,0,0,0,0,0,0,0,0,0,0,0,0,0,0,0,0,0,0,0,0,0,0,0,0
Pyridoxine determination from pharmaceutical products using two kinetic methods,"Bungau, S; Copolovici, L; Baldea, I; Merca, V",,,,REVISTA DE CHIMIE,DEC 2004,2004,55,12,,,,1009,1013,,,,,5,0.25,0,0,0,0,0,0,0,0,0,0,0,0,0,0,0,0,0,0,0,0,0,0,0,0,0,0,0,0,0,0,0,0,0,0,0,0,0,0,0,0,0,0,3,2,0,0,0,0,0
Temperature sensors based on nanostructured PbS films,"Popescu, V",,,,REVISTA DE CHIMIE,DEC 2004,2004,55,12,,,,983,985,,,,,5,0.25,0,0,0,0,0,0,0,0,0,0,0,0,0,0,0,0,0,0,0,0,0,0,0,0,0,0,0,0,0,0,0,2,1,0,0,0,1,0,0,0,0,0,0,0,1,0,0,0,0
The determination of microelements content in some Romanian wines by atomic absorption spectrometry,"Serdaru, A; Pascu, L; Vladescu, L",,,,REVISTA DE CHIMIE,DEC 2004,2004,55,12,,,,935,938,,,,,5,0.25,0,0,0,0,0,0,0,0,0,0,0,0,0,0,0,0,0,0,0,0,0,0,0,0,0,0,0,0,0,0,3,1,0,0,1,0,0,0,0,0,0,0,0,0,0,0,0,0,0
"Manipulation, seduction and ostensive ideology (Advertisement)","Codoban, A",,,,JOURNAL FOR THE STUDY OF RELIGIONS AND IDEOLOGIES,SPR 2003,2003,2,4,,,,122,138,,,,,5,0.24,0,0,0,0,0,0,0,0,0,0,0,0,0,0,0,0,0,0,0,0,0,0,0,0,0,0,0,0,0,0,0,0,0,0,0,1,2,0,0,0,0,0,1,0,1,0,0,0,0
Polymeric quaternary phosphonium salts preparation by chloromethylated polymers reaction with tertiary phosphines,"Davidescu, CM; Popa, A; Ilia, G; Iliescu, S; Dehelean, G; Macarie, L; Pacureanu, L",,,,REVISTA DE CHIMIE,OCT 2001,2001,52,10,,,,553,558,,,,,5,0.22,0,0,0,0,0,0,0,0,0,0,0,0,0,0,0,0,0,0,0,0,0,0,0,0,0,0,0,2,0,1,2,0,0,0,0,0,0,0,0,0,0,0,0,0,0,0,0,0,0
A new method for the benzoic acid synthesis,"Bratulescu, G; Le Bigot, Y; Delmas, M",,,,REVISTA DE CHIMIE,MAY 2000,2000,51,5,,,,354,358,,,,,5,0.21,0,0,0,0,0,0,0,0,0,0,0,0,0,0,0,0,0,0,0,0,0,0,0,0,0,0,0,1,0,1,1,0,0,0,0,0,0,0,0,0,0,0,0,0,1,1,0,0,0
Synthesis and characterisation of some new 5-nitro and 3-chlorobenzo vertical bar b vertical bar thiofuran-2-carboxylic acids esters with sterols,"Baciu, I; Vilcu, R; Draghici, C; Bairaktaris, G; Sferdean, C",,,,REVISTA DE CHIMIE,MAR 2000,2000,51,3,,,,216,220,,,,,5,0.21,0,0,0,0,0,0,0,0,0,0,0,0,0,0,0,0,0,0,0,0,0,0,0,0,0,1,2,1,0,0,0,0,1,0,0,0,0,0,0,0,0,0,0,0,0,0,0,0,0
Bubbling columns hydrodynamics II. An experimental study regarding the gas bubbles size,"Mihai, M; Pincovschi, I",,,,REVISTA DE CHIMIE,MAR 1999,1999,50,3,,,,194,204,,,,,5,0.2,0,0,0,0,0,0,0,0,0,0,0,0,0,0,0,0,0,0,0,0,0,0,0,0,0,0,0,0,0,4,1,0,0,0,0,0,0,0,0,0,0,0,0,0,0,0,0,0,0
Considerations on the tetraarylporphyrins synthesis process,"Ion, RM; Grigorescu, M; Stirbet, A",,,,REVISTA DE CHIMIE,DEC 1997,1997,48,12,,,,923,929,,,,,5,0.19,0,0,0,0,0,0,0,0,0,0,0,0,0,0,0,0,0,0,0,0,0,0,0,0,0,0,0,0,0,0,0,0,1,0,0,0,1,1,0,1,0,1,0,0,0,0,0,0,0
Preparation and characterization of the chemically modified R-silicagel .4. R n-octadecyl silicagel,"Coman, V; Marutoiu, C; Marcu, G; Brie, M",,,,REVISTA DE CHIMIE,JAN 1997,1997,48,1,,,,33,39,,,,,5,0.19,0,0,0,0,0,0,0,0,0,0,0,0,0,0,0,0,0,0,0,0,0,0,1,0,0,1,0,0,1,0,0,0,0,0,1,0,0,1,0,0,0,0,0,0,0,0,0,0,0
