Title,Authors,Corporate Authors,Editors,Book Editors,Source Title,Publication Date,Publication Year,Volume,Issue,Part Number,Supplement,Special Issue,Beginning Page,Ending Page,Article Number,DOI,Conference Title,Conference Date,Total Citations,Average per Year,1975,1976,1977,1978,1979,1980,1981,1982,1983,1984,1985,1986,1987,1988,1989,1990,1991,1992,1993,1994,1995,1996,1997,1998,1999,2000,2001,2002,2003,2004,2005,2006,2007,2008,2009,2010,2011,2012,2013,2014,2015,2016,2017,2018,2019,2020,2021,2022,2023
INFLUENCE OF THE SOLUTIONS INLET TEMPERATURE UPON THE ENERGETIC YIELD AND ATOMIZERS YIELDS,"BELCU, M; TURTOI, D",,,,REVISTA DE CHIMIE,MAY 1995,1995,46,5,,,,461,466,,,,,0,0,0,0,0,0,0,0,0,0,0,0,0,0,0,0,0,0,0,0,0,0,0,0,0,0,0,0,0,0,0,0,0,0,0,0,0,0,0,0,0,0,0,0,0,0,0,0,0,0,0
LIQUID-LIQUID PHASE-DIAGRAM CALCULATION IN POLYMER-SOLVENT-NONSOLVENT SYSTEMS,"BJOLA, B; GEANA, D",,,,REVISTA DE CHIMIE,MAY 1995,1995,46,5,,,,430,435,,,,,0,0,0,0,0,0,0,0,0,0,0,0,0,0,0,0,0,0,0,0,0,0,0,0,0,0,0,0,0,0,0,0,0,0,0,0,0,0,0,0,0,0,0,0,0,0,0,0,0,0,0
ISOOCTANE THERMAL-DECOMPOSITION,"BOLOCAN, I; CUIBAN, E; CUIBAN, F",,,,REVISTA DE CHIMIE,MAY 1995,1995,46,5,,,,420,425,,,,,0,0,0,0,0,0,0,0,0,0,0,0,0,0,0,0,0,0,0,0,0,0,0,0,0,0,0,0,0,0,0,0,0,0,0,0,0,0,0,0,0,0,0,0,0,0,0,0,0,0,0
CYANAMIDE IONS POTENTIOMETRIC DETERMINATION IN THE WASTE-WATERS,"DUMITRESCU, V; DUMITRESCU, M; ION, A",,,,REVISTA DE CHIMIE,MAY 1995,1995,46,5,,,,485,489,,,,,0,0,0,0,0,0,0,0,0,0,0,0,0,0,0,0,0,0,0,0,0,0,0,0,0,0,0,0,0,0,0,0,0,0,0,0,0,0,0,0,0,0,0,0,0,0,0,0,0,0,0
NEW METHODS FOR BROFIMEN DETERMINATION WITH CR(III) COMPLEX ANIONS,"GANESCU, I; CHIRIGIU, L",,,,REVISTA DE CHIMIE,MAY 1995,1995,46,5,,,,472,477,,,,,0,0,0,0,0,0,0,0,0,0,0,0,0,0,0,0,0,0,0,0,0,0,0,0,0,0,0,0,0,0,0,0,0,0,0,0,0,0,0,0,0,0,0,0,0,0,0,0,0,0,0
"SEPARATION AND DETERMINATION OF SOME CATIONS IN THE TRANSITIONAL METALS OR PLATINIC METALS GROUPS, AS INTERNAL COMPLEXES WITH MERCAPTOBENZOTHIAZOLE, BY THE REVERSE-PHASE HIGH-PERFORMANCE LIQUID-CHROMATOGRAPHY","ILIE, VA; PATROESCU, C; DAVID, V; DOROFTEI, F",,,,REVISTA DE CHIMIE,MAY 1995,1995,46,5,,,,478,484,,,,,0,0,0,0,0,0,0,0,0,0,0,0,0,0,0,0,0,0,0,0,0,0,0,0,0,0,0,0,0,0,0,0,0,0,0,0,0,0,0,0,0,0,0,0,0,0,0,0,0,0,0
HYDROGEN-OXYGEN STOICHIOMETRIC MIXTURES CATALYTIC BURNING AT LOW-TEMPERATURES,"IONITA, G",,,,REVISTA DE CHIMIE,MAY 1995,1995,46,5,,,,448,454,,,,,0,0,0,0,0,0,0,0,0,0,0,0,0,0,0,0,0,0,0,0,0,0,0,0,0,0,0,0,0,0,0,0,0,0,0,0,0,0,0,0,0,0,0,0,0,0,0,0,0,0,0
A NEW QSAR FOR N-METHYL-(PHENYL CARBAMATES),"LASZLO, T",,,,REVISTA DE CHIMIE,MAY 1995,1995,46,5,,,,413,419,,,,,0,0,0,0,0,0,0,0,0,0,0,0,0,0,0,0,0,0,0,0,0,0,0,0,0,0,0,0,0,0,0,0,0,0,0,0,0,0,0,0,0,0,0,0,0,0,0,0,0,0,0
"ELECTRICAL AND THERMAL STUDIES UPON SAME MN2+, CO2+ NI2+ AND CU2+ COMPLEX COMBINATIONS WITH METHYL ANTHRANILAMIDE","ROSU, T; NEGOIU, D",,,,REVISTA DE CHIMIE,MAY 1995,1995,46,5,,,,455,460,,,,,0,0,0,0,0,0,0,0,0,0,0,0,0,0,0,0,0,0,0,0,0,0,0,0,0,0,0,0,0,0,0,0,0,0,0,0,0,0,0,0,0,0,0,0,0,0,0,0,0,0,0
"POSSIBILITIES OF ETHENE ELIMINATION FROM POLLUTING GAS-MIXTURES, BY ADSORPTION IN SELECTIVE SOLVENTS","BARCA, F; BRINDAS, N; MOLDOVAN, N; PARASCHIVESCU, G; MARINESCU, A; POPA, A",,,,REVISTA DE CHIMIE,APR 1995,1995,46,4,,,,335,337,,,,,0,0,0,0,0,0,0,0,0,0,0,0,0,0,0,0,0,0,0,0,0,0,0,0,0,0,0,0,0,0,0,0,0,0,0,0,0,0,0,0,0,0,0,0,0,0,0,0,0,0,0
A STUDY OF THE OXIDIZING REACTIONS CATALYZED BY THE PEROXIDASE IN ORGANIC MEDICINE,"BOERIU, C",,,,REVISTA DE CHIMIE,APR 1995,1995,46,4,,,,317,320,,,,,0,0,0,0,0,0,0,0,0,0,0,0,0,0,0,0,0,0,0,0,0,0,0,0,0,0,0,0,0,0,0,0,0,0,0,0,0,0,0,0,0,0,0,0,0,0,0,0,0,0,0
AMYL ALCOHOL ANODE OXIDATION ON SMOOTH PLATINUM OR LEAD DIOXIDE ELECTRODES,"BRANZOI, V; IFTIME, F; CIURA, G; ZAMFIR, S",,,,REVISTA DE CHIMIE,APR 1995,1995,46,4,,,,352,361,,,,,0,0,0,0,0,0,0,0,0,0,0,0,0,0,0,0,0,0,0,0,0,0,0,0,0,0,0,0,0,0,0,0,0,0,0,0,0,0,0,0,0,0,0,0,0,0,0,0,0,0,0
FINNED HEAT-EXCHANGER .1. GENERAL AND FUNDAMENTAL-ASPECTS,"LAVRIC, D; SOARE, G; LAVRIC, V; MUNTEAN, O; DANCIU, E",,,,REVISTA DE CHIMIE,APR 1995,1995,46,4,,,,362,378,,,,,0,0,0,0,0,0,0,0,0,0,0,0,0,0,0,0,0,0,0,0,0,0,0,0,0,0,0,0,0,0,0,0,0,0,0,0,0,0,0,0,0,0,0,0,0,0,0,0,0,0,0
FAST PH (PX) - METERS CALIBRATION,"RADU, C",,,,REVISTA DE CHIMIE,APR 1995,1995,46,4,,,,384,390,,,,,0,0,0,0,0,0,0,0,0,0,0,0,0,0,0,0,0,0,0,0,0,0,0,0,0,0,0,0,0,0,0,0,0,0,0,0,0,0,0,0,0,0,0,0,0,0,0,0,0,0,0
"SYNTHESIS OF SOME SULFONYL GROUP CONTAINING BENZOIMIDAZOLE DERIVATIVES, HAVING TUBERCULOSTATIC POTENTIAL","RUSU, G; BUDEANU, CH",,,,REVISTA DE CHIMIE,APR 1995,1995,46,4,,,,330,334,,,,,0,0,0,0,0,0,0,0,0,0,0,0,0,0,0,0,0,0,0,0,0,0,0,0,0,0,0,0,0,0,0,0,0,0,0,0,0,0,0,0,0,0,0,0,0,0,0,0,0,0,0
NEW ANALYTICAL SYSTEMS FOR THE FINISHED COSMETICS CHARACTERIZATION .1. CHROMATOGRAPHIC IDENTIFICATION OF THE POPLAR BUD EXTRACT PHENOL GLYCOSIDES IN THE COSMETIC LOTIONS,"SCUREI, D",,,,REVISTA DE CHIMIE,APR 1995,1995,46,4,,,,379,383,,,,,0,0,0,0,0,0,0,0,0,0,0,0,0,0,0,0,0,0,0,0,0,0,0,0,0,0,0,0,0,0,0,0,0,0,0,0,0,0,0,0,0,0,0,0,0,0,0,0,0,0,0
TRIARYLMETHANE AND DIAZOMETHANE DYESTUFFS DERIVED FROM THE 5-FORMYLVARDILLIN,"SEBE, I; NICOLAE, A; MAIOR, O",,,,REVISTA DE CHIMIE,APR 1995,1995,46,4,,,,321,324,,,,,0,0,0,0,0,0,0,0,0,0,0,0,0,0,0,0,0,0,0,0,0,0,0,0,0,0,0,0,0,0,0,0,0,0,0,0,0,0,0,0,0,0,0,0,0,0,0,0,0,0,0
N-CYCLOHEXYLBENZOTHIAZYLSULPHENAMIDE SYNTHESIS FOLLOW-UP BY REDOX POTENTIAL MEASUREMENTS,"SERBAN, S; AIVANESE, G; TOTIR, ND; BALBAIE, E; STOICESCU, S",,,,REVISTA DE CHIMIE,APR 1995,1995,46,4,,,,325,329,,,,,0,0,0,0,0,0,0,0,0,0,0,0,0,0,0,0,0,0,0,0,0,0,0,0,0,0,0,0,0,0,0,0,0,0,0,0,0,0,0,0,0,0,0,0,0,0,0,0,0,0,0
"TRANSITORY REGIME OPTIMIZATION FOR THE CONTINUOUS REACTOR WITH PERFECT MIXING, USING THE 2ND-ORDER VARIATIONAL CALCULUS","DANCIU, T; BOZGA, G",,,,REVISTA DE CHIMIE,MAR 1995,1995,46,3,,,,259,266,,,,,0,0,0,0,0,0,0,0,0,0,0,0,0,0,0,0,0,0,0,0,0,0,0,0,0,0,0,0,0,0,0,0,0,0,0,0,0,0,0,0,0,0,0,0,0,0,0,0,0,0,0
"REMEMBRANCES ABOUT PROFESSOR MIHAIL,RAUL","DOBRESCU, V",,,,REVISTA DE CHIMIE,MAR 1995,1995,46,3,,,,199,199,,,,,0,0,0,0,0,0,0,0,0,0,0,0,0,0,0,0,0,0,0,0,0,0,0,0,0,0,0,0,0,0,0,0,0,0,0,0,0,0,0,0,0,0,0,0,0,0,0,0,0,0,0
GENERALIZED RELATION FOR THE MATERIALS FATIGUE CALCULATION,"JINESCU, VV",,,,REVISTA DE CHIMIE,MAR 1995,1995,46,3,,,,308,312,,,,,0,0,0,0,0,0,0,0,0,0,0,0,0,0,0,0,0,0,0,0,0,0,0,0,0,0,0,0,0,0,0,0,0,0,0,0,0,0,0,0,0,0,0,0,0,0,0,0,0,0,0
"SOLVING THE MATHEMATICAL-MODEL OF THE REACTORS - HAVING THE CATALYST DEPOSITED AT THE WALL AND AXIAL-FLOW, USING THE MULTIGRADE METHOD","JUNCU, G",,,,REVISTA DE CHIMIE,MAR 1995,1995,46,3,,,,207,213,,,,,0,0,0,0,0,0,0,0,0,0,0,0,0,0,0,0,0,0,0,0,0,0,0,0,0,0,0,0,0,0,0,0,0,0,0,0,0,0,0,0,0,0,0,0,0,0,0,0,0,0,0
"MIHAIL,RAUL - FOUNDER OF THE CHEMICAL REACTORS SCHOOL IN ROMANIA","MUNTEAN, O",,,,REVISTA DE CHIMIE,MAR 1995,1995,46,3,,,,193,198,,,,,0,0,0,0,0,0,0,0,0,0,0,0,0,0,0,0,0,0,0,0,0,0,0,0,0,0,0,0,0,0,0,0,0,0,0,0,0,0,0,0,0,0,0,0,0,0,0,0,0,0,0
STYRENE POLYMERIZATION IN TUBULAR REACTORS - A PARAMETRICAL SENSITIVITY CASE,"NAGY, I; SPOITU, C",,,,REVISTA DE CHIMIE,MAR 1995,1995,46,3,,,,271,276,,,,,0,0,0,0,0,0,0,0,0,0,0,0,0,0,0,0,0,0,0,0,0,0,0,0,0,0,0,0,0,0,0,0,0,0,0,0,0,0,0,0,0,0,0,0,0,0,0,0,0,0,0
CONTRIBUTIONS TO HIGH-PRESSURE ETHYLENE POLYMERIZATION PROCESS KINETICS SIMULATION,"POSTELNICESCU, P",,,,REVISTA DE CHIMIE,MAR 1995,1995,46,3,,,,225,231,,,,,0,0,0,0,0,0,0,0,0,0,0,0,0,0,0,0,0,0,0,0,0,0,0,0,0,0,0,0,0,0,0,0,0,0,0,0,0,0,0,0,0,0,0,0,0,0,0,0,0,0,0
RHEOMETRICAL DETERMINATIONS AT LOW SHEARING STRESS,"STEFAN, A; CINCU, C",,,,REVISTA DE CHIMIE,MAR 1995,1995,46,3,,,,298,307,,,,,0,0,0,0,0,0,0,0,0,0,0,0,0,0,0,0,0,0,0,0,0,0,0,0,0,0,0,0,0,0,0,0,0,0,0,0,0,0,0,0,0,0,0,0,0,0,0,0,0,0,0
"SANDWICH-TYPE ELECTROCHEMICAL REACTOR, WITHOUT DIVISIONS, USED FOR THE ORGANIC-COMPOUNDS SYNTHESIS","VASZILCSIN, N; RADOI, I; TARANU, I; FAGADAR, G",,,,REVISTA DE CHIMIE,MAR 1995,1995,46,3,,,,219,224,,,,,0,0,0,0,0,0,0,0,0,0,0,0,0,0,0,0,0,0,0,0,0,0,0,0,0,0,0,0,0,0,0,0,0,0,0,0,0,0,0,0,0,0,0,0,0,0,0,0,0,0,0
BIOLOGICAL ANALOGIES OF THE ARTIFICIAL NEURAL NETWORKS,"WOINAROSCHY, A",,,,REVISTA DE CHIMIE,MAR 1995,1995,46,3,,,,267,270,,,,,0,0,0,0,0,0,0,0,0,0,0,0,0,0,0,0,0,0,0,0,0,0,0,0,0,0,0,0,0,0,0,0,0,0,0,0,0,0,0,0,0,0,0,0,0,0,0,0,0,0,0
RESEARCH REGARDING THE HARD - CHROMIUM PLATING ELECTROCHEMICAL PROCESS,"BANDRABUR, F; APOSTOLESCU, M; IVASCAN, S",,,,REVISTA DE CHIMIE,FEB 1995,1995,46,2,,,,161,165,,,,,0,0,0,0,0,0,0,0,0,0,0,0,0,0,0,0,0,0,0,0,0,0,0,0,0,0,0,0,0,0,0,0,0,0,0,0,0,0,0,0,0,0,0,0,0,0,0,0,0,0,0
A STUDY CONCERNING THE AIR SATURATION WITH WATER AND METHANOL VAPORS IN ORDER TO OBTAIN THE FORMALDEHYDE SYNTHESIS REACTION MIXTURES,"CARLOGANU, C; ENACHESCU, M; CRISTU, Z; URSACHE, M",,,,REVISTA DE CHIMIE,FEB 1995,1995,46,2,,,,122,129,,,,,0,0,0,0,0,0,0,0,0,0,0,0,0,0,0,0,0,0,0,0,0,0,0,0,0,0,0,0,0,0,0,0,0,0,0,0,0,0,0,0,0,0,0,0,0,0,0,0,0,0,0
BENZENE - PROPANOL - WATER TERNARY DIAGRAM,"DAESCU, C; POP, C; TOMAS, S; STANOIEV, Z; MURESAN, S; IOVU, H",,,,REVISTA DE CHIMIE,FEB 1995,1995,46,2,,,,130,133,,,,,0,0,0,0,0,0,0,0,0,0,0,0,0,0,0,0,0,0,0,0,0,0,0,0,0,0,0,0,0,0,0,0,0,0,0,0,0,0,0,0,0,0,0,0,0,0,0,0,0,0,0
A NEW PREDICTOR VARIABLE FOR QSAR - MOLECULES ELECTRIC FORMS SIMILITUDE,"LASZLO, T",,,,REVISTA DE CHIMIE,FEB 1995,1995,46,2,,,,113,116,,,,,0,0,0,0,0,0,0,0,0,0,0,0,0,0,0,0,0,0,0,0,0,0,0,0,0,0,0,0,0,0,0,0,0,0,0,0,0,0,0,0,0,0,0,0,0,0,0,0,0,0,0
CERTAIN ANTICORROSIVE COATINGS BEHAVIOR IN THE RAILWAY SYSTEM,"RADOVICI, O; POPESCU, B; DEMETRESCU, I; GHITA, F",,,,REVISTA DE CHIMIE,FEB 1995,1995,46,2,,,,166,172,,,,,0,0,0,0,0,0,0,0,0,0,0,0,0,0,0,0,0,0,0,0,0,0,0,0,0,0,0,0,0,0,0,0,0,0,0,0,0,0,0,0,0,0,0,0,0,0,0,0,0,0,0
HYDRODYNAMIC INSTABILITIES AT THE NITROBENZENE - WATER INTERFACE,"STOICAGUZUN, A; DINCULESCU, D",,,,REVISTA DE CHIMIE,FEB 1995,1995,46,2,,,,139,142,,,,,0,0,0,0,0,0,0,0,0,0,0,0,0,0,0,0,0,0,0,0,0,0,0,0,0,0,0,0,0,0,0,0,0,0,0,0,0,0,0,0,0,0,0,0,0,0,0,0,0,0,0
"THE MORPHOLOGY OF LOW-DENSITY POLYETHYLENE, PHOTORETICULATED IN NATURAL CLIMATE","ANDREI, C; LUNCASUROLEA, E; POPESCU, S",,,,MATERIALE PLASTICE,1995,1995,32,2,,,,102,105,,,,,0,0,0,0,0,0,0,0,0,0,0,0,0,0,0,0,0,0,0,0,0,0,0,0,0,0,0,0,0,0,0,0,0,0,0,0,0,0,0,0,0,0,0,0,0,0,0,0,0,0,0
POLYMERS USED AA HUMIDITY SENSORS,"BODEA, O; ROMAN, C; LEVI, A; CORDOS, E; MANOVICIU, I",,,,MATERIALE PLASTICE,1995,1995,32,2,,,,115,119,,,,,0,0,0,0,0,0,0,0,0,0,0,0,0,0,0,0,0,0,0,0,0,0,0,0,0,0,0,0,0,0,0,0,0,0,0,0,0,0,0,0,0,0,0,0,0,0,0,0,0,0,0
TETRAHYDROFURFURYL ALCOHOL ANODE OXIDATION ON BRIGHT PLATINUM AND LEAD DIOXIDE ELECTRODES,"BRANZOI, V; IFTIME, F; CIURA, G; NICOLA, M",,,,REVISTA DE CHIMIE,JAN 1995,1995,46,1,,,,44,52,,,,,0,0,0,0,0,0,0,0,0,0,0,0,0,0,0,0,0,0,0,0,0,0,0,0,0,0,0,0,0,0,0,0,0,0,0,0,0,0,0,0,0,0,0,0,0,0,0,0,0,0,0
STUDIES CONCERNING THE BIOLOGICAL TREATMENT ANALYTICAL CONTROL OF THE PETROCHEMICAL COMPLEXES WASTE-WATERS HAVING A HIGH HYDROGEN-SULFIDE AND SULFIDES CONTENT,"CHRILA, E; MAGEARU, V",,,,REVISTA DE CHIMIE,JAN 1995,1995,46,1,,,,80,82,,,,,0,0,0,0,0,0,0,0,0,0,0,0,0,0,0,0,0,0,0,0,0,0,0,0,0,0,0,0,0,0,0,0,0,0,0,0,0,0,0,0,0,0,0,0,0,0,0,0,0,0,0
MACROMOLECULAR COMPOUNDS USED FRO PHARMACEUTICAL PURPOSES .2. KINETIC PROCESSES,"DENES, F; TOPOR, C",,,,MATERIALE PLASTICE,1995,1995,32,2,,,,120,126,,,,,0,0,0,0,0,0,0,0,0,0,0,0,0,0,0,0,0,0,0,0,0,0,0,0,0,0,0,0,0,0,0,0,0,0,0,0,0,0,0,0,0,0,0,0,0,0,0,0,0,0,0
STRUCTURAL MODIFICATIONS OF SOME PHENOLIC ANTIOXIDANTS UNDER THERMODESTRUCTIVE CONDITIONS,"GIURGINCA, M; ASLAN, R",,,,MATERIALE PLASTICE,1995,1995,32,1,,,,54,60,,,,,0,0,0,0,0,0,0,0,0,0,0,0,0,0,0,0,0,0,0,0,0,0,0,0,0,0,0,0,0,0,0,0,0,0,0,0,0,0,0,0,0,0,0,0,0,0,0,0,0,0,0
MASS-TRANSFER IN THIN LIQUID-FILMS .2. RUGOSITY INFLUENCE UPON THE FILM THICKNESS,"MAMALIGA, I; TUDOSE, RZ; MERICA, E",,,,REVISTA DE CHIMIE,JAN 1995,1995,46,1,,,,63,69,,,,,0,0,0,0,0,0,0,0,0,0,0,0,0,0,0,0,0,0,0,0,0,0,0,0,0,0,0,0,0,0,0,0,0,0,0,0,0,0,0,0,0,0,0,0,0,0,0,0,0,0,0
PHYSICAL AND MECHANICAL CHARACTERISTICS OF SANDWICH STRUCTURES WITH METAL HONEYCOMBS,"NOVAC, O; NOVAC, O; IOVU, H; TEODORESCU, M; CALINESCU, I",,,,MATERIALE PLASTICE,1995,1995,32,2,,,,112,114,,,,,0,0,0,0,0,0,0,0,0,0,0,0,0,0,0,0,0,0,0,0,0,0,0,0,0,0,0,0,0,0,0,0,0,0,0,0,0,0,0,0,0,0,0,0,0,0,0,0,0,0,0
THEORETICAL-EXPERIMENTAL ANALYSIS OF STRESSES FOR A 600-CU-CM GASEOUS-HYDROGEN SPHERICAL TANK .2.,"PAVEL, A; POPESCU, D; MIHAILESCU, M",,,,REVISTA DE CHIMIE,JAN 1995,1995,46,1,,,,83,93,,,,,0,0,0,0,0,0,0,0,0,0,0,0,0,0,0,0,0,0,0,0,0,0,0,0,0,0,0,0,0,0,0,0,0,0,0,0,0,0,0,0,0,0,0,0,0,0,0,0,0,0,0
AN EXPERIMENTAL-STUDY CONCERNING THE NITROBENZENE CHLORINATION REACTION,"PETROV, P; BACALOGLU, I; BOC, I; MACARIE, I; VLAD, F",,,,REVISTA DE CHIMIE,JAN 1995,1995,46,1,,,,20,24,,,,,0,0,0,0,0,0,0,0,0,0,0,0,0,0,0,0,0,0,0,0,0,0,0,0,0,0,0,0,0,0,0,0,0,0,0,0,0,0,0,0,0,0,0,0,0,0,0,0,0,0,0
PROCESS KINETICS OF THE SULFUR-DIOXIDE CATALYTIC REDUCTION WITH CARBON OXIDE,"PINCOVSCHI, E; SALCIANU, EI",,,,REVISTA DE CHIMIE,JAN 1995,1995,46,1,,,,57,62,,,,,0,0,0,0,0,0,0,0,0,0,0,0,0,0,0,0,0,0,0,0,0,0,0,0,0,0,0,0,0,0,0,0,0,0,0,0,0,0,0,0,0,0,0,0,0,0,0,0,0,0,0
SYNTHESIS AND STRUCTURE STUDY CONCERNING SOME CHALCONES DERIVED FROM O-FORMIL-P-ALPHA-CUMYLPHENOL,"POPA, E; CHECHE, D; DOBRE, N",,,,REVISTA DE CHIMIE,JAN 1995,1995,46,1,,,,25,32,,,,,0,0,0,0,0,0,0,0,0,0,0,0,0,0,0,0,0,0,0,0,0,0,0,0,0,0,0,0,0,0,0,0,0,0,0,0,0,0,0,0,0,0,0,0,0,0,0,0,0,0,0
SOME ASPECTS REGARDING THE MATHEMATIC MODELING OF EPSILON-CAPROLACTAM HYDROLYTIC POLYMERIZATION PROCESS,"POSTELNICESCU, P; DUMITRESCU, AM; DOJA, S",,,,MATERIALE PLASTICE,1995,1995,32,1,,,,69,73,,,,,0,0,0,0,0,0,0,0,0,0,0,0,0,0,0,0,0,0,0,0,0,0,0,0,0,0,0,0,0,0,0,0,0,0,0,0,0,0,0,0,0,0,0,0,0,0,0,0,0,0,0
STATISTICAL-METHODS FOR THE CORRELATION OF THE LOW-DENSITY POLYETHYLENE FILM PHYSICAL-MECHANICAL CHARACTERISTICS WITH THE EXTRUSION - BLOWING PLANTS OPERATING PARAMETERS,"POSTELNICESCU, P; BOLOGA, V; DANCIU, E",,,,MATERIALE PLASTICE,1995,1995,32,2,,,,106,111,,,,,0,0,0,0,0,0,0,0,0,0,0,0,0,0,0,0,0,0,0,0,0,0,0,0,0,0,0,0,0,0,0,0,0,0,0,0,0,0,0,0,0,0,0,0,0,0,0,0,0,0,0
ADSORPTION SPECTRA OF CERTAIN TETRAHEDRON STRUCTURE COMPLEX COMBINATION .4.,"ROSU, T; NEGOIU, D",,,,REVISTA DE CHIMIE,JAN 1995,1995,46,1,,,,53,56,,,,,0,0,0,0,0,0,0,0,0,0,0,0,0,0,0,0,0,0,0,0,0,0,0,0,0,0,0,0,0,0,0,0,0,0,0,0,0,0,0,0,0,0,0,0,0,0,0,0,0,0,0
METALLIC COMPLEXES HAVING HYDRAZONE-CLASS LIGANDS .2. URANYL(II) COMBINATIONS WITH SULPHONAMIDOBENZHYDRAZONE,"SILAGHIDUMITRESCU, L; MICUSEMENIUC, R",,,,REVISTA DE CHIMIE,JAN 1995,1995,46,1,,,,40,43,,,,,0,0,0,0,0,0,0,0,0,0,0,0,0,0,0,0,0,0,0,0,0,0,0,0,0,0,0,0,0,0,0,0,0,0,0,0,0,0,0,0,0,0,0,0,0,0,0,0,0,0,0
TURNING THE NONSTANDARD POLYISOPRENE TO GOOD ACCOUNT,"STAICU, D; CIUPITOIU, A; POPA, A; GOLDENBERG, N",,,,MATERIALE PLASTICE,1995,1995,32,2,,,,133,137,,,,,0,0,0,0,0,0,0,0,0,0,0,0,0,0,0,0,0,0,0,0,0,0,0,0,0,0,0,0,0,0,0,0,0,0,0,0,0,0,0,0,0,0,0,0,0,0,0,0,0,0,0
AZOIC PHOTOCHROMIC POLYMERS,"TIBIRNA, M; CHIRIAC, CL",,,,MATERIALE PLASTICE,1995,1995,32,2,,,,81,87,,,,,0,0,0,0,0,0,0,0,0,0,0,0,0,0,0,0,0,0,0,0,0,0,0,0,0,0,0,0,0,0,0,0,0,0,0,0,0,0,0,0,0,0,0,0,0,0,0,0,0,0,0
TECHNOLOGICAL MANAGEMENT BY EVOLUTIVE OPERATION OF A CONTINUOUS PLANT FOR THE ALKYLATES SULFONATION-SULPHATATION WITH SO3,"VASILESCU, I; SZEKELY, G; SECRETEANU, A; IHOS, A",,,,REVISTA DE CHIMIE,JAN 1995,1995,46,1,,,,33,39,,,,,0,0,0,0,0,0,0,0,0,0,0,0,0,0,0,0,0,0,0,0,0,0,0,0,0,0,0,0,0,0,0,0,0,0,0,0,0,0,0,0,0,0,0,0,0,0,0,0,0,0,0
LIQUID-LIQUID EQUILIBRIUM IN THE TOLUENE-EPICHLORHYDRIN - ETHYLENEGLYCOL TERNARY-SYSTEM,"BOLOGA, V; SURDU, I; DANCIU, E",,,,REVISTA DE CHIMIE,NOV 1994,1994,45,11,,,,979,983,,,,,0,0,0,0,0,0,0,0,0,0,0,0,0,0,0,0,0,0,0,0,0,0,0,0,0,0,0,0,0,0,0,0,0,0,0,0,0,0,0,0,0,0,0,0,0,0,0,0,0,0,0
KINETIC-PARAMETERS ESTIMATION FOR CATALYTIC PROCESSES INVOLVING DEACTIVATION - APPLICATION IN M-XYLENE ISOMERIZATION,"BOZGA, G; SANDULESCU, I; WOINAROSCHY, A",,,,REVISTA DE CHIMIE,NOV 1994,1994,45,11,,,,951,959,,,,,0,0,0,0,0,0,0,0,0,0,0,0,0,0,0,0,0,0,0,0,0,0,0,0,0,0,0,0,0,0,0,0,0,0,0,0,0,0,0,0,0,0,0,0,0,0,0,0,0,0,0
THE POSSIBILITY OF REDUCING SEVERAL OF THE POLLUTING EFFECTS FROM SOME HALOGENATED ALKANES (ALKENES) PRODUCING PLANTS,"CRETU, S; MANEA, S",,,,REVISTA DE CHIMIE,NOV 1994,1994,45,11,,,,1007,1012,,,,,0,0,0,0,0,0,0,0,0,0,0,0,0,0,0,0,0,0,0,0,0,0,0,0,0,0,0,0,0,0,0,0,0,0,0,0,0,0,0,0,0,0,0,0,0,0,0,0,0,0,0
RESOL DISPERSANTS,"DAESCU, C; IOVU, H; STANOIEV, Z; MACARIE, I",,,,REVISTA DE CHIMIE,NOV 1994,1994,45,11,,,,960,964,,,,,0,0,0,0,0,0,0,0,0,0,0,0,0,0,0,0,0,0,0,0,0,0,0,0,0,0,0,0,0,0,0,0,0,0,0,0,0,0,0,0,0,0,0,0,0,0,0,0,0,0,0
SOME ASPECTS CONCERNING THE CARBON-DIOXIDE MASS-TRANSFER IN BIOSYNTHESIS LIQUIDS,"GAVRILESCU, M; ROMAN, RV; EFIMOV, V; CARLIGEANU, L",,,,REVISTA DE CHIMIE,NOV 1994,1994,45,11,,,,973,978,,,,,0,0,0,0,0,0,0,0,0,0,0,0,0,0,0,0,0,0,0,0,0,0,0,0,0,0,0,0,0,0,0,0,0,0,0,0,0,0,0,0,0,0,0,0,0,0,0,0,0,0,0
THEORETICAL-EXPERIMENTAL ANALYSIS OF THE STRESS-STATES FOR A 600-CU-M SPHERICAL TANK FOR GASEOUS-HYDROGEN (I),"PAVEL, A; POPESCU, D; MIHAILESCU, M",,,,REVISTA DE CHIMIE,NOV 1994,1994,45,11,,,,1013,1023,,,,,0,0,0,0,0,0,0,0,0,0,0,0,0,0,0,0,0,0,0,0,0,0,0,0,0,0,0,0,0,0,0,0,0,0,0,0,0,0,0,0,0,0,0,0,0,0,0,0,0,0,0
"CERNATESCU,RADU, CONTRIBUTOR TO ROMANIAN EDUCATION AND SCIENCE - 100TH-ANNIVERSARY OF HIS BIRTH","SIMIONESCU, CI",,,,REVISTA DE CHIMIE,NOV 1994,1994,45,11,,,,939,940,,,,,0,0,0,0,0,0,0,0,0,0,0,0,0,0,0,0,0,0,0,0,0,0,0,0,0,0,0,0,0,0,0,0,0,0,0,0,0,0,0,0,0,0,0,0,0,0,0,0,0,0,0
GENERALIZED-MODEL FOR CENTRIFUGAL FIELD SETTLING ANALYSIS,"ANGHEL, C; ANGHEL, VD",,,,REVISTA DE CHIMIE,SEP 1994,1994,45,9,,,,808,814,,,,,0,0,0,0,0,0,0,0,0,0,0,0,0,0,0,0,0,0,0,0,0,0,0,0,0,0,0,0,0,0,0,0,0,0,0,0,0,0,0,0,0,0,0,0,0,0,0,0,0,0,0
AROMATIC ISOTHIOCYANATES REACTIONS WITH EPSILON-AMINO-CAPRONIC ACID ETHYLIC AND GLYCOLIC ESTER,"ANTOHE, N; SURPATEANU, G; CRETU, S; TUFAN, E; POPA, M; LUPU, V",,,,REVISTA DE CHIMIE,SEP 1994,1994,45,9,,,,756,761,,,,,0,0,0,0,0,0,0,0,0,0,0,0,0,0,0,0,0,0,0,0,0,0,0,0,0,0,0,0,0,0,0,0,0,0,0,0,0,0,0,0,0,0,0,0,0,0,0,0,0,0,0
SULFUR-HEXAFLUORIDE PREPARATION AND PURIFICATION,"AXENTE, D; ABRUDEAN, M; BALDEA, A",,,,REVISTA DE CHIMIE,SEP 1994,1994,45,9,,,,774,780,,,,,0,0,0,0,0,0,0,0,0,0,0,0,0,0,0,0,0,0,0,0,0,0,0,0,0,0,0,0,0,0,0,0,0,0,0,0,0,0,0,0,0,0,0,0,0,0,0,0,0,0,0
THERMAL AGENTS CONSUMPTION REDUCTION BY TECHNOLOGICAL REENDOWMENT OF THE HEAT-EXCHANGER SYSTEMS,"DOBRINESCU, D",,,,REVISTA DE CHIMIE,SEP 1994,1994,45,9,,,,815,822,,,,,0,0,0,0,0,0,0,0,0,0,0,0,0,0,0,0,0,0,0,0,0,0,0,0,0,0,0,0,0,0,0,0,0,0,0,0,0,0,0,0,0,0,0,0,0,0,0,0,0,0,0
STUDIES CONCERNING THE PENTAERYTHRITOL AND CALCIUM FORMIATE SOLUTIONS CONCENTRATION,"KOHN, D; SORA, M; GABOR, D",,,,REVISTA DE CHIMIE,SEP 1994,1994,45,9,,,,769,773,,,,,0,0,0,0,0,0,0,0,0,0,0,0,0,0,0,0,0,0,0,0,0,0,0,0,0,0,0,0,0,0,0,0,0,0,0,0,0,0,0,0,0,0,0,0,0,0,0,0,0,0,0
PHTHALOCYANINE-BASED REACTIVE DYES CONTAINING N-METHYLOL-IMINO-BIS-PROPIONAMIDE GROUPS,"PETROV, P; OLARIU, L; BOC, I",,,,REVISTA DE CHIMIE,SEP 1994,1994,45,9,,,,753,755,,,,,0,0,0,0,0,0,0,0,0,0,0,0,0,0,0,0,0,0,0,0,0,0,0,0,0,0,0,0,0,0,0,0,0,0,0,0,0,0,0,0,0,0,0,0,0,0,0,0,0,0,0
P-ALPHA-CUMYLPHENOL DERIVATIVES .6. PREPARATION AND CLAISEN TRANSPOSITION OF CERTAIN ALLYL ETHERS OF P-ALPHA-CUMYLPHENOL,"POPA, E",,,,REVISTA DE CHIMIE,SEP 1994,1994,45,9,,,,762,768,,,,,0,0,0,0,0,0,0,0,0,0,0,0,0,0,0,0,0,0,0,0,0,0,0,0,0,0,0,0,0,0,0,0,0,0,0,0,0,0,0,0,0,0,0,0,0,0,0,0,0,0,0
A KINETIC METHOD FOR DETERMINING THE CARBON OXIDE IN THE AIR WITH THE SILVER COMBINATION OF THE P-SULPHAMIDOPHENOXYACETIC ACID,"RUSU, V; DRAGOS, D",,,,REVISTA DE CHIMIE,SEP 1994,1994,45,9,,,,791,796,,,,,0,0,0,0,0,0,0,0,0,0,0,0,0,0,0,0,0,0,0,0,0,0,0,0,0,0,0,0,0,0,0,0,0,0,0,0,0,0,0,0,0,0,0,0,0,0,0,0,0,0,0
"MATHEMATICAL REPRESENTATION OF UNSTEADY-STATE TOTAL DISPLACEMENT REACTORS, BY LINEARIZED MODELS","BOZGA, O; NAGY, I; TSAKIRIS, C",,,,REVISTA DE CHIMIE,AUG 1994,1994,45,8,,,,706,711,,,,,0,0,0,0,0,0,0,0,0,0,0,0,0,0,0,0,0,0,0,0,0,0,0,0,0,0,0,0,0,0,0,0,0,0,0,0,0,0,0,0,0,0,0,0,0,0,0,0,0,0,0
"PROFESSOR BRATU,EM,A. CONTRIBUTION TO THE ROMANIAN CHEMICAL-ENGINEERING SCHOOL DEVELOPMENT","DANCIU, E",,,,REVISTA DE CHIMIE,AUG 1994,1994,45,8,,,,648,649,,,,,0,0,0,0,0,0,0,0,0,0,0,0,0,0,0,0,0,0,0,0,0,0,0,0,0,0,0,0,0,0,0,0,0,0,0,0,0,0,0,0,0,0,0,0,0,0,0,0,0,0,0
STATE EQUATION METHOD APPLIED TO THE HIGH-PRESSURE BINARY-SYSTEMS STUDY,"FEROIU, V; GEANA, D",,,,REVISTA DE CHIMIE,AUG 1994,1994,45,8,,,,735,741,,,,,0,0,0,0,0,0,0,0,0,0,0,0,0,0,0,0,0,0,0,0,0,0,0,0,0,0,0,0,0,0,0,0,0,0,0,0,0,0,0,0,0,0,0,0,0,0,0,0,0,0,0
"RECOLLECTIONS ABOUT PROFESSOR BRATU,EM,A","FLOAREA, O",,,,REVISTA DE CHIMIE,AUG 1994,1994,45,8,,,,650,651,,,,,0,0,0,0,0,0,0,0,0,0,0,0,0,0,0,0,0,0,0,0,0,0,0,0,0,0,0,0,0,0,0,0,0,0,0,0,0,0,0,0,0,0,0,0,0,0,0,0,0,0,0
TEMPERATURE AND CONCENTRATION GRADIENTS IN THE CATALYST GRANULE AT THE AMMONIA-SYNTHESIS,"ILIUTA, I; MUNTEAN, O",,,,REVISTA DE CHIMIE,AUG 1994,1994,45,8,,,,724,734,,,,,0,0,0,0,0,0,0,0,0,0,0,0,0,0,0,0,0,0,0,0,0,0,0,0,0,0,0,0,0,0,0,0,0,0,0,0,0,0,0,0,0,0,0,0,0,0,0,0,0,0,0
MASS-TRANSFER BIOPROCESS INTERCONDITIONING IN BIOREACTORS .3. BIOCHEMICAL REACTOR,"JINESCU, G; LAVRIC, V",,,,REVISTA DE CHIMIE,AUG 1994,1994,45,8,,,,663,686,,,,,0,0,0,0,0,0,0,0,0,0,0,0,0,0,0,0,0,0,0,0,0,0,0,0,0,0,0,0,0,0,0,0,0,0,0,0,0,0,0,0,0,0,0,0,0,0,0,0,0,0,0
GAS-LIQUID EQUILIBRIUM-CONSTANT DETERMINATION IN THE FIELD OF VERY-LOW CONCENTRATIONS,"STRATULA, C",,,,REVISTA DE CHIMIE,AUG 1994,1994,45,8,,,,695,699,,,,,0,0,0,0,0,0,0,0,0,0,0,0,0,0,0,0,0,0,0,0,0,0,0,0,0,0,0,0,0,0,0,0,0,0,0,0,0,0,0,0,0,0,0,0,0,0,0,0,0,0,0
INDIVIDUAL MASS-TRANSFER COEFFICIENTS FOR THIN-FILM LIQUID FLOW,"TUDOSE, RZ; MAMALIGA, I",,,,REVISTA DE CHIMIE,AUG 1994,1994,45,8,,,,652,662,,,,,0,0,0,0,0,0,0,0,0,0,0,0,0,0,0,0,0,0,0,0,0,0,0,0,0,0,0,0,0,0,0,0,0,0,0,0,0,0,0,0,0,0,0,0,0,0,0,0,0,0,0
LIQUID-FILMS HYDRODYNAMICS IN THE INLET AREA,"VASILESCU, P",,,,REVISTA DE CHIMIE,AUG 1994,1994,45,8,,,,712,719,,,,,0,0,0,0,0,0,0,0,0,0,0,0,0,0,0,0,0,0,0,0,0,0,0,0,0,0,0,0,0,0,0,0,0,0,0,0,0,0,0,0,0,0,0,0,0,0,0,0,0,0,0
POLYOLEFIN COMPOSITES WITH IR ABSORBERS,"ANDREI, G; MORARU, M; ANDREI, C; HOGEA, I; PITA, S; ROSCA, M",,,,REVISTA DE CHIMIE,JUL 1994,1994,45,7,,,,548,553,,,,,0,0,0,0,0,0,0,0,0,0,0,0,0,0,0,0,0,0,0,0,0,0,0,0,0,0,0,0,0,0,0,0,0,0,0,0,0,0,0,0,0,0,0,0,0,0,0,0,0,0,0
2-CHLOROPROPIONIC ACID-ESTERS REACTION WITH PYRIDINE,"BARBULESCU, E; CUZA, O; TANASE, D",,,,REVISTA DE CHIMIE,JUL 1994,1994,45,7,,,,567,570,,,,,0,0,0,0,0,0,0,0,0,0,0,0,0,0,0,0,0,0,0,0,0,0,0,0,0,0,0,0,0,0,0,0,0,0,0,0,0,0,0,0,0,0,0,0,0,0,0,0,0,0,0
"REPORT ON THE CHEMISTRY SYMPOSIUM HELD ON MAY 20-21, 1994 AT THE UNIVERSITY OF CLUJ-NAPOCA, ROMANIA IN HONOR OF ITS 75TH-ANNIVERSARY","GOCAN, S",,,,REVISTA DE CHIMIE,JUL 1994,1994,45,7,,,,542,544,,,,,0,0,0,0,0,0,0,0,0,0,0,0,0,0,0,0,0,0,0,0,0,0,0,0,0,0,0,0,0,0,0,0,0,0,0,0,0,0,0,0,0,0,0,0,0,0,0,0,0,0,0
LIQUID-VAPOR-EQUILIBRIUM DATA FOR THE VINYL-BENZENE ACETATE SYSTEM,"IONESCU, I; SAVESCU, V; CIOROIANU, D",,,,REVISTA DE CHIMIE,JUL 1994,1994,45,7,,,,578,582,,,,,0,0,0,0,0,0,0,0,0,0,0,0,0,0,0,0,0,0,0,0,0,0,0,0,0,0,0,0,0,0,0,0,0,0,0,0,0,0,0,0,0,0,0,0,0,0,0,0,0,0,0
A NEW ATTEMPT TO MODEL THE SOLUBILITY PHENOMENON,"LASZLO, T",,,,REVISTA DE CHIMIE,JUL 1994,1994,45,7,,,,571,577,,,,,0,0,0,0,0,0,0,0,0,0,0,0,0,0,0,0,0,0,0,0,0,0,0,0,0,0,0,0,0,0,0,0,0,0,0,0,0,0,0,0,0,0,0,0,0,0,0,0,0,0,0
75 YEARS OF ROMANIAN CHEMICAL EDUCATION AT ALMA-MATER-NAPOCENSIS,"MAGER, S",,,,REVISTA DE CHIMIE,JUL 1994,1994,45,7,,,,531,541,,,,,0,0,0,0,0,0,0,0,0,0,0,0,0,0,0,0,0,0,0,0,0,0,0,0,0,0,0,0,0,0,0,0,0,0,0,0,0,0,0,0,0,0,0,0,0,0,0,0,0,0,0
CORROSION-BEHAVIOR OF SOME METALS IN IMPURIFIED ALCOHOLS .2. ACETIC-ACID AS CONTAMINANT,"NICOLA, M; BADEA, T",,,,REVISTA DE CHIMIE,JUL 1994,1994,45,7,,,,614,619,,,,,0,0,0,0,0,0,0,0,0,0,0,0,0,0,0,0,0,0,0,0,0,0,0,0,0,0,0,0,0,0,0,0,0,0,0,0,0,0,0,0,0,0,0,0,0,0,0,0,0,0,0
"ADSORPTION CAPACITY DETERMINATION FOR THE OXYGEN IN THE HYDROGEN, ON ACTIVE-CARBON, AT 45-K TEMPERATURE","AVRAM, I; CRISTESCU, I; PECULEA, M",,,,REVISTA DE CHIMIE,JUN 1994,1994,45,6,,,,474,476,,,,,0,0,0,0,0,0,0,0,0,0,0,0,0,0,0,0,0,0,0,0,0,0,0,0,0,0,0,0,0,0,0,0,0,0,0,0,0,0,0,0,0,0,0,0,0,0,0,0,0,0,0
"S2-CONTENT DETERMINATION IN POLLUTED WATERS, BY MOLECULAR ADSORPTION SPECTROMETRY WITH PARAAMINODIMETHYLANILINE","CHIRILA, E; MAGEARU, V",,,,REVISTA DE CHIMIE,JUN 1994,1994,45,6,,,,508,510,,,,,0,0,0,0,0,0,0,0,0,0,0,0,0,0,0,0,0,0,0,0,0,0,0,0,0,0,0,0,0,0,0,0,0,0,0,0,0,0,0,0,0,0,0,0,0,0,0,0,0,0,0
LIQUID MEMBRANES ON SUPPORT - THEORETICAL ASPECTS,"DALEA, V; MASU, S; COCHECI, V",,,,REVISTA DE CHIMIE,JUN 1994,1994,45,6,,,,468,473,,,,,0,0,0,0,0,0,0,0,0,0,0,0,0,0,0,0,0,0,0,0,0,0,0,0,0,0,0,0,0,0,0,0,0,0,0,0,0,0,0,0,0,0,0,0,0,0,0,0,0,0,0
REAL OPERATION ANALYSIS OF A CRYOGENIC REFRIGERATION INSTALLATION BY PRECOOLING LAMINATION BASED ON THE MINIMUM ENTROPY GENERATION,"DOBROVICESCU, A; RADCENCO, V",,,,REVISTA DE CHIMIE,JUN 1994,1994,45,6,,,,493,500,,,,,0,0,0,0,0,0,0,0,0,0,0,0,0,0,0,0,0,0,0,0,0,0,0,0,0,0,0,0,0,0,0,0,0,0,0,0,0,0,0,0,0,0,0,0,0,0,0,0,0,0,0
POTENTIOMETRIC DETERMINATION OF SOME WEAKLY ACID PHARMACEUTICALS,"HOPIRTEAN, E; KORMOS, F",,,,REVISTA DE CHIMIE,JUN 1994,1994,45,6,,,,501,503,,,,,0,0,0,0,0,0,0,0,0,0,0,0,0,0,0,0,0,0,0,0,0,0,0,0,0,0,0,0,0,0,0,0,0,0,0,0,0,0,0,0,0,0,0,0,0,0,0,0,0,0,0
L-PHENYL ALANINE PRODUCTION .2.,"OANA, D; BOERIU, C",,,,REVISTA DE CHIMIE,JUN 1994,1994,45,6,,,,459,462,,,,,0,0,0,0,0,0,0,0,0,0,0,0,0,0,0,0,0,0,0,0,0,0,0,0,0,0,0,0,0,0,0,0,0,0,0,0,0,0,0,0,0,0,0,0,0,0,0,0,0,0,0
"SOFTWARE-SUPPORT FOR COMPARING THE CYLINDRICAL DIFFUSION WITH THE ONE, IN THE OXYGEN CHROMOPOTENTIOMETRIC ELECTROREDUCTION PROCESS","PICA, EM; ZUBAC, M",,,,REVISTA DE CHIMIE,JUN 1994,1994,45,6,,,,504,507,,,,,0,0,0,0,0,0,0,0,0,0,0,0,0,0,0,0,0,0,0,0,0,0,0,0,0,0,0,0,0,0,0,0,0,0,0,0,0,0,0,0,0,0,0,0,0,0,0,0,0,0,0
CATALYST NATURE INFLUENCE UPON LIQUID-PHASE N-ALKANES OXIDATION WITH MOLECULAR-OXYGEN,"PONORAN, I; PAPAHAGI, L; PARAUSANU, V",,,,REVISTA DE CHIMIE,JUN 1994,1994,45,6,,,,451,454,,,,,0,0,0,0,0,0,0,0,0,0,0,0,0,0,0,0,0,0,0,0,0,0,0,0,0,0,0,0,0,0,0,0,0,0,0,0,0,0,0,0,0,0,0,0,0,0,0,0,0,0,0
"COMPOSITION CALCULATION FOR THE PHASES COEXISTING IN THE LIQUID-LIQUID TERNARY-SYSTEM, USING BINARY LIQUID-VAPOR-EQUILIBRIUM DATA","CIOROIANU, D; IONESCU, I; SAVESCU, V; MEHEDINTEANU, L",,,,REVISTA DE CHIMIE,APR 1994,1994,45,4,,,,317,322,,,,,0,0,0,0,0,0,0,0,0,0,0,0,0,0,0,0,0,0,0,0,0,0,0,0,0,0,0,0,0,0,0,0,0,0,0,0,0,0,0,0,0,0,0,0,0,0,0,0,0,0,0
